8.8

c2

06:49:23.417218 IP 10.10.0.2.58887 > 10.30.0.2.9: S 4276211852:4276211852(0) win 5840 <mss 1460,sackOK,timestamp 98360 0,nop,wscale 1>
06:49:23.418424 IP 10.30.0.2.9 > 10.10.0.2.58887: S 4273050635:4273050635(0) ack 4276211853 win 5792 <mss 536,sackOK,timestamp 98360 98360,nop,wscale 1>
06:49:23.418748 IP 10.10.0.2.58887 > 10.30.0.2.9: . ack 1 win 2920 <nop,nop,timestamp 98360 98360>
06:49:25.050148 IP 10.10.0.2.58887 > 10.30.0.2.9: P 1:8(7) ack 1 win 2920 <nop,nop,timestamp 98530 98360>
06:49:25.051518 IP 10.30.0.2.9 > 10.10.0.2.58887: . ack 8 win 2896 <nop,nop,timestamp 98524 98530>
06:49:30.102146 IP 10.10.0.2.58887 > 10.30.0.2.9: F 8:8(0) ack 1 win 2920 <nop,nop,timestamp 99035 98524>
06:49:30.107455 IP 10.30.0.2.9 > 10.10.0.2.58887: F 1:1(0) ack 9 win 2896 <nop,nop,timestamp 99029 99035>
06:49:30.108388 IP 10.10.0.2.58887 > 10.30.0.2.9: . ack 2 win 2920 <nop,nop,timestamp 99035 99029>



c3

06:49:23.221836 IP 10.10.0.2.58887 > 10.30.0.2.9: S 4276211852:4276211852(0) win 5840 <mss 1460,sackOK,timestamp 98360 0,nop,wscale 1>
06:49:23.222096 IP 10.30.0.2.9 > 10.10.0.2.58887: S 4273050635:4273050635(0) ack 4276211853 win 5792 <mss 536,sackOK,timestamp 98360 98360,nop,wscale 1>
06:49:23.222587 IP 10.10.0.2.58887 > 10.30.0.2.9: . ack 1 win 2920 <nop,nop,timestamp 98360 98360>
06:49:24.854145 IP 10.10.0.2.58887 > 10.30.0.2.9: P 1:8(7) ack 1 win 2920 <nop,nop,timestamp 98530 98360>
06:49:24.855065 IP 10.30.0.2.9 > 10.10.0.2.58887: . ack 8 win 2896 <nop,nop,timestamp 98524 98530>
06:49:29.906170 IP 10.10.0.2.58887 > 10.30.0.2.9: F 8:8(0) ack 1 win 2920 <nop,nop,timestamp 99035 98524>
06:49:29.910953 IP 10.30.0.2.9 > 10.10.0.2.58887: F 1:1(0) ack 9 win 2896 <nop,nop,timestamp 99029 99035>
06:49:29.912562 IP 10.10.0.2.58887 > 10.30.0.2.9: . ack 2 win 2920 <nop,nop,timestamp 99035 99029>


8.9

07:02:29.904850 IP 10.10.0.2.43429 > 10.30.0.2.3002: S 3712860313:3712860313(0) win 5840 <mss 1460,sackOK,timestamp 177030 0,nop,wscale 1>
07:02:29.906336 IP 10.30.0.2.3002 > 10.10.0.2.43429: S 3719104286:3719104286(0) ack 3712860314 win 5792 <mss 536,sackOK,timestamp 177029 177030,nop,wscale 1>
07:02:29.908496 IP 10.10.0.2.43429 > 10.30.0.2.3002: . ack 1 win 2920 <nop,nop,timestamp 177035 177029>
07:02:29.909589 IP 10.10.0.2.43429 > 10.30.0.2.3002: . 1:525(524) ack 1 win 2920 <nop,nop,timestamp 177035 177029>
07:02:29.910283 IP 10.10.0.2.43429 > 10.30.0.2.3002: . 525:1049(524) ack 1 win 2920 <nop,nop,timestamp 177035 177029>
07:02:29.910324 IP 10.10.0.2.43429 > 10.30.0.2.3002: . 1049:1573(524) ack 1 win 2920 <nop,nop,timestamp 177035 177029>
07:02:29.910368 IP 10.30.0.2.3002 > 10.10.0.2.43429: . ack 525 win 3420 <nop,nop,timestamp 177029 177035>
07:02:29.910544 IP 10.10.0.2.43429 > 10.30.0.2.3002: . 1573:2097(524) ack 1 win 2920 <nop,nop,timestamp 177035 177029>
07:02:29.911448 IP 10.30.0.2.3002 > 10.10.0.2.43429: . ack 1049 win 3944 <nop,nop,timestamp 177029 177035>
07:02:29.911483 IP 10.30.0.2.3002 > 10.10.0.2.43429: . ack 1573 win 4468 <nop,nop,timestamp 177029 177035>
07:02:29.911511 IP 10.30.0.2.3002 > 10.10.0.2.43429: . ack 2097 win 4992 <nop,nop,timestamp 177029 177035>
07:02:29.911763 IP 10.10.0.2.43429 > 10.30.0.2.3002: . 2097:2621(524) ack 1 win 2920 <nop,nop,timestamp 177035 177029>
07:02:29.912186 IP 10.30.0.2.3002 > 10.10.0.2.43429: . ack 2621 win 5516 <nop,nop,timestamp 177029 177035>
07:02:29.913895 IP 10.10.0.2.43429 > 10.30.0.2.3002: P 2621:3145(524) ack 1 win 2920 <nop,nop,timestamp 177035 177029>
07:02:29.914507 IP 10.10.0.2.43429 > 10.30.0.2.3002: . 3145:3669(524) ack 1 win 2920 <nop,nop,timestamp 177035 177029>
07:02:29.915070 IP 10.30.0.2.3002 > 10.10.0.2.43429: . ack 3145 win 6040 <nop,nop,timestamp 177029 177035>
07:02:29.915167 IP 10.10.0.2.43429 > 10.30.0.2.3002: . 3669:4193(524) ack 1 win 2920 <nop,nop,timestamp 177035 177029>
07:02:29.917083 IP 10.30.0.2.3002 > 10.10.0.2.43429: . ack 3669 win 6564 <nop,nop,timestamp 177029 177035>
07:02:29.917108 IP 10.10.0.2.43429 > 10.30.0.2.3002: . 4193:4717(524) ack 1 win 2920 <nop,nop,timestamp 177035 177029>
07:02:29.917200 IP 10.10.0.2.43429 > 10.30.0.2.3002: . 4717:5241(524) ack 1 win 2920 <nop,nop,timestamp 177035 177029>
07:02:29.917279 IP 10.10.0.2.43429 > 10.30.0.2.3002: . 5241:5765(524) ack 1 win 2920 <nop,nop,timestamp 177035 177029>
07:02:29.917367 IP 10.10.0.2.43429 > 10.30.0.2.3002: P 5765:6289(524) ack 1 win 2920 <nop,nop,timestamp 177035 177029>
07:02:29.920587 IP 10.30.0.2.3002 > 10.10.0.2.43429: . ack 4193 win 7088 <nop,nop,timestamp 177029 177035>
07:02:29.920607 IP 10.30.0.2.3002 > 10.10.0.2.43429: . ack 4717 win 7612 <nop,nop,timestamp 177029 177035>
07:02:29.920617 IP 10.30.0.2.3002 > 10.10.0.2.43429: . ack 5241 win 8136 <nop,nop,timestamp 177029 177035>
07:02:29.920635 IP 10.10.0.2.43429 > 10.30.0.2.3002: . 6289:6813(524) ack 1 win 2920 <nop,nop,timestamp 177035 177029>
07:02:29.920799 IP 10.30.0.2.3002 > 10.10.0.2.43429: . ack 5765 win 8660 <nop,nop,timestamp 177029 177035>
07:02:29.920827 IP 10.10.0.2.43429 > 10.30.0.2.3002: . 6813:7337(524) ack 1 win 2920 <nop,nop,timestamp 177035 177029>
07:02:29.920912 IP 10.10.0.2.43429 > 10.30.0.2.3002: . 7337:7861(524) ack 1 win 2920 <nop,nop,timestamp 177035 177029>
07:02:29.920998 IP 10.10.0.2.43429 > 10.30.0.2.3002: P 7861:8193(332) ack 1 win 2920 <nop,nop,timestamp 177035 177029>
07:02:29.921046 IP 10.10.0.2.43429 > 10.30.0.2.3002: . 8193:8717(524) ack 1 win 2920 <nop,nop,timestamp 177035 177029>
07:02:29.921130 IP 10.10.0.2.43429 > 10.30.0.2.3002: . 8717:9241(524) ack 1 win 2920 <nop,nop,timestamp 177035 177029>
07:02:29.921183 IP 10.30.0.2.3002 > 10.10.0.2.43429: . ack 6289 win 8660 <nop,nop,timestamp 177029 177035>
07:02:29.921209 IP 10.30.0.2.3002 > 10.10.0.2.43429: . ack 6813 win 8660 <nop,nop,timestamp 177029 177035>
07:02:29.921232 IP 10.30.0.2.3002 > 10.10.0.2.43429: . ack 7337 win 8660 <nop,nop,timestamp 177029 177035>
07:02:29.921256 IP 10.30.0.2.3002 > 10.10.0.2.43429: . ack 7861 win 8660 <nop,nop,timestamp 177029 177035>
07:02:29.921280 IP 10.30.0.2.3002 > 10.10.0.2.43429: . ack 8717 win 8660 <nop,nop,timestamp 177029 177035>
07:02:29.921369 IP 10.10.0.2.43429 > 10.30.0.2.3002: . 9241:9765(524) ack 1 win 2920 <nop,nop,timestamp 177035 177029>
07:02:29.921458 IP 10.10.0.2.43429 > 10.30.0.2.3002: . 9765:10289(524) ack 1 win 2920 <nop,nop,timestamp 177035 177029>
07:02:29.921505 IP 10.10.0.2.43429 > 10.30.0.2.3002: . 10289:10813(524) ack 1 win 2920 <nop,nop,timestamp 177035 177029>
07:02:29.921587 IP 10.10.0.2.43429 > 10.30.0.2.3002: . 10813:11337(524) ack 1 win 2920 <nop,nop,timestamp 177035 177029>
07:02:29.921635 IP 10.10.0.2.43429 > 10.30.0.2.3002: . 11337:11861(524) ack 1 win 2920 <nop,nop,timestamp 177035 177029>
07:02:29.921717 IP 10.10.0.2.43429 > 10.30.0.2.3002: . 11861:12385(524) ack 1 win 2920 <nop,nop,timestamp 177035 177029>
07:02:29.921764 IP 10.10.0.2.43429 > 10.30.0.2.3002: P 12385:12909(524) ack 1 win 2920 <nop,nop,timestamp 177035 177029>
07:02:29.921846 IP 10.10.0.2.43429 > 10.30.0.2.3002: . 12909:13433(524) ack 1 win 2920 <nop,nop,timestamp 177035 177029>
07:02:29.921900 IP 10.30.0.2.3002 > 10.10.0.2.43429: . ack 9765 win 8660 <nop,nop,timestamp 177029 177035>
07:02:29.921930 IP 10.30.0.2.3002 > 10.10.0.2.43429: . ack 10813 win 8660 <nop,nop,timestamp 177029 177035>
07:02:29.921955 IP 10.30.0.2.3002 > 10.10.0.2.43429: . ack 11861 win 8660 <nop,nop,timestamp 177029 177035>
07:02:29.921979 IP 10.30.0.2.3002 > 10.10.0.2.43429: . ack 12909 win 8660 <nop,nop,timestamp 177029 177035>
07:02:29.923226 IP 10.10.0.2.43429 > 10.30.0.2.3002: . 13433:13957(524) ack 1 win 2920 <nop,nop,timestamp 177035 177029>
07:02:29.923328 IP 10.10.0.2.43429 > 10.30.0.2.3002: . 13957:14481(524) ack 1 win 2920 <nop,nop,timestamp 177035 177029>
07:02:29.923377 IP 10.10.0.2.43429 > 10.30.0.2.3002: . 14481:15005(524) ack 1 win 2920 <nop,nop,timestamp 177035 177029>
07:02:29.923452 IP 10.10.0.2.43429 > 10.30.0.2.3002: . 15005:15529(524) ack 1 win 2920 <nop,nop,timestamp 177035 177029>
07:02:29.923498 IP 10.10.0.2.43429 > 10.30.0.2.3002: . 15529:16053(524) ack 1 win 2920 <nop,nop,timestamp 177035 177029>
07:02:29.923568 IP 10.10.0.2.43429 > 10.30.0.2.3002: . 16053:16577(524) ack 1 win 2920 <nop,nop,timestamp 177035 177029>
07:02:29.923622 IP 10.30.0.2.3002 > 10.10.0.2.43429: . ack 13957 win 8660 <nop,nop,timestamp 177029 177035>
07:02:29.923663 IP 10.10.0.2.43429 > 10.30.0.2.3002: . 16577:17101(524) ack 1 win 2920 <nop,nop,timestamp 177035 177029>
07:02:29.923732 IP 10.10.0.2.43429 > 10.30.0.2.3002: . 17101:17625(524) ack 1 win 2920 <nop,nop,timestamp 177035 177029>
07:02:29.923779 IP 10.10.0.2.43429 > 10.30.0.2.3002: . 17625:18149(524) ack 1 win 2920 <nop,nop,timestamp 177035 177029>
07:02:29.923848 IP 10.10.0.2.43429 > 10.30.0.2.3002: . 18149:18673(524) ack 1 win 2920 <nop,nop,timestamp 177035 177029>
07:02:29.923895 IP 10.10.0.2.43429 > 10.30.0.2.3002: . 18673:19197(524) ack 1 win 2920 <nop,nop,timestamp 177035 177029>
07:02:29.923972 IP 10.30.0.2.3002 > 10.10.0.2.43429: . ack 15005 win 8660 <nop,nop,timestamp 177029 177035>
07:02:29.923997 IP 10.30.0.2.3002 > 10.10.0.2.43429: . ack 16053 win 8660 <nop,nop,timestamp 177029 177035>
07:02:29.924032 IP 10.30.0.2.3002 > 10.10.0.2.43429: . ack 17101 win 8660 <nop,nop,timestamp 177029 177035>
07:02:29.924057 IP 10.30.0.2.3002 > 10.10.0.2.43429: . ack 18149 win 8660 <nop,nop,timestamp 177029 177035>
07:02:29.924081 IP 10.30.0.2.3002 > 10.10.0.2.43429: . ack 19197 win 8660 <nop,nop,timestamp 177029 177035>
07:02:29.925217 IP 10.10.0.2.43429 > 10.30.0.2.3002: . 23913:24437(524) ack 1 win 2920 <nop,nop,timestamp 177035 177029>
07:02:29.925307 IP 10.10.0.2.43429 > 10.30.0.2.3002: P 24437:24577(140) ack 1 win 2920 <nop,nop,timestamp 177035 177029>
07:02:29.925381 IP 10.10.0.2.43429 > 10.30.0.2.3002: . 24577:25101(524) ack 1 win 2920 <nop,nop,timestamp 177035 177029>
07:02:29.925446 IP 10.10.0.2.43429 > 10.30.0.2.3002: . 25101:25625(524) ack 1 win 2920 <nop,nop,timestamp 177035 177029>
07:02:29.925516 IP 10.10.0.2.43429 > 10.30.0.2.3002: . 25625:26149(524) ack 1 win 2920 <nop,nop,timestamp 177035 177029>
07:02:29.925580 IP 10.10.0.2.43429 > 10.30.0.2.3002: . 26149:26673(524) ack 1 win 2920 <nop,nop,timestamp 177035 177029>
07:02:29.925698 IP 10.30.0.2.3002 > 10.10.0.2.43429: . ack 19197 win 8660 <nop,nop,timestamp 177029 177035,nop,nop,sack 1 {23913:24437}>
07:02:29.925743 IP 10.10.0.2.43429 > 10.30.0.2.3002: . 26673:27197(524) ack 1 win 2920 <nop,nop,timestamp 177035 177029>
07:02:29.925814 IP 10.10.0.2.43429 > 10.30.0.2.3002: . 27197:27721(524) ack 1 win 2920 <nop,nop,timestamp 177035 177029>
07:02:29.925890 IP 10.10.0.2.43429 > 10.30.0.2.3002: . 27721:28245(524) ack 1 win 2920 <nop,nop,timestamp 177035 177029>
07:02:29.925956 IP 10.10.0.2.43429 > 10.30.0.2.3002: . 28245:28769(524) ack 1 win 2920 <nop,nop,timestamp 177035 177029>
07:02:29.926026 IP 10.10.0.2.43429 > 10.30.0.2.3002: . 28769:29293(524) ack 1 win 2920 <nop,nop,timestamp 177035 177029>
07:02:29.926097 IP 10.30.0.2.3002 > 10.10.0.2.43429: . ack 19197 win 8660 <nop,nop,timestamp 177029 177035,nop,nop,sack 1 {23913:24577}>
07:02:29.926122 IP 10.30.0.2.3002 > 10.10.0.2.43429: . ack 19197 win 8660 <nop,nop,timestamp 177029 177035,nop,nop,sack 1 {23913:25101}>
07:02:29.926147 IP 10.30.0.2.3002 > 10.10.0.2.43429: . ack 19197 win 8660 <nop,nop,timestamp 177029 177035,nop,nop,sack 1 {23913:25625}>
07:02:29.926162 IP 10.30.0.2.3002 > 10.10.0.2.43429: . ack 19197 win 8660 <nop,nop,timestamp 177029 177035,nop,nop,sack 1 {23913:26149}>
07:02:29.926193 IP 10.30.0.2.3002 > 10.10.0.2.43429: . ack 19197 win 8660 <nop,nop,timestamp 177029 177035,nop,nop,sack 1 {23913:26673}>
07:02:29.926225 IP 10.10.0.2.43429 > 10.30.0.2.3002: . 19197:19721(524) ack 1 win 2920 <nop,nop,timestamp 177035 177029>
07:02:29.926303 IP 10.30.0.2.3002 > 10.10.0.2.43429: . ack 19197 win 8660 <nop,nop,timestamp 177029 177035,nop,nop,sack 1 {23913:27197}>
07:02:29.926328 IP 10.30.0.2.3002 > 10.10.0.2.43429: . ack 19197 win 8660 <nop,nop,timestamp 177029 177035,nop,nop,sack 1 {23913:27721}>
07:02:29.926353 IP 10.30.0.2.3002 > 10.10.0.2.43429: . ack 19197 win 8660 <nop,nop,timestamp 177029 177035,nop,nop,sack 1 {23913:28245}>
07:02:29.926378 IP 10.30.0.2.3002 > 10.10.0.2.43429: . ack 19197 win 8660 <nop,nop,timestamp 177029 177035,nop,nop,sack 1 {23913:28769}>
07:02:29.926403 IP 10.30.0.2.3002 > 10.10.0.2.43429: . ack 19197 win 8660 <nop,nop,timestamp 177029 177035,nop,nop,sack 1 {23913:29293}>
07:02:29.926433 IP 10.30.0.2.3002 > 10.10.0.2.43429: . ack 19721 win 8398 <nop,nop,timestamp 177029 177035,nop,nop,sack 1 {23913:29293}>
07:02:29.927399 IP 10.10.0.2.43429 > 10.30.0.2.3002: . 19721:20245(524) ack 1 win 2920 <nop,nop,timestamp 177035 177029>
07:02:29.927503 IP 10.10.0.2.43429 > 10.30.0.2.3002: . 20245:20769(524) ack 1 win 2920 <nop,nop,timestamp 177035 177029>
07:02:29.927587 IP 10.10.0.2.43429 > 10.30.0.2.3002: P 20769:21293(524) ack 1 win 2920 <nop,nop,timestamp 177035 177029>
07:02:29.927663 IP 10.10.0.2.43429 > 10.30.0.2.3002: . 21293:21817(524) ack 1 win 2920 <nop,nop,timestamp 177035 177029>
07:02:29.927813 IP 10.10.0.2.43429 > 10.30.0.2.3002: . 21817:22341(524) ack 1 win 2920 <nop,nop,timestamp 177035 177029>
07:02:29.927915 IP 10.30.0.2.3002 > 10.10.0.2.43429: . ack 20245 win 8136 <nop,nop,timestamp 177029 177035,nop,nop,sack 1 {23913:29293}>
07:02:29.927944 IP 10.10.0.2.43429 > 10.30.0.2.3002: . 22341:22865(524) ack 1 win 2920 <nop,nop,timestamp 177035 177029>
07:02:29.928027 IP 10.30.0.2.3002 > 10.10.0.2.43429: . ack 20769 win 7874 <nop,nop,timestamp 177029 177035,nop,nop,sack 1 {23913:29293}>
07:02:29.928053 IP 10.30.0.2.3002 > 10.10.0.2.43429: . ack 21293 win 7612 <nop,nop,timestamp 177029 177035,nop,nop,sack 1 {23913:29293}>
07:02:29.928076 IP 10.30.0.2.3002 > 10.10.0.2.43429: . ack 21817 win 7350 <nop,nop,timestamp 177029 177035,nop,nop,sack 1 {23913:29293}>
07:02:29.928100 IP 10.30.0.2.3002 > 10.10.0.2.43429: . ack 22341 win 7088 <nop,nop,timestamp 177029 177035,nop,nop,sack 1 {23913:29293}>
07:02:29.928125 IP 10.30.0.2.3002 > 10.10.0.2.43429: . ack 22865 win 6826 <nop,nop,timestamp 177029 177035,nop,nop,sack 1 {23913:29293}>
07:02:29.928147 IP 10.10.0.2.43429 > 10.30.0.2.3002: . 22865:23389(524) ack 1 win 2920 <nop,nop,timestamp 177035 177029>
07:02:29.928230 IP 10.30.0.2.3002 > 10.10.0.2.43429: . ack 23389 win 6564 <nop,nop,timestamp 177029 177035,nop,nop,sack 1 {23913:29293}>
07:02:29.928345 IP 10.10.0.2.43429 > 10.30.0.2.3002: . 23389:23913(524) ack 1 win 2920 <nop,nop,timestamp 177035 177029>
07:02:29.928432 IP 10.30.0.2.3002 > 10.10.0.2.43429: . ack 29293 win 4068 <nop,nop,timestamp 177029 177035>
07:02:29.929763 IP 10.10.0.2.43429 > 10.30.0.2.3002: . 31913:32437(524) ack 1 win 2920 <nop,nop,timestamp 177035 177029>
07:02:29.929856 IP 10.10.0.2.43429 > 10.30.0.2.3002: . 32437:32961(524) ack 1 win 2920 <nop,nop,timestamp 177035 177029>
07:02:29.929941 IP 10.30.0.2.3002 > 10.10.0.2.43429: . ack 29293 win 4068 <nop,nop,timestamp 177029 177035,nop,nop,sack 1 {31913:32437}>
07:02:29.929970 IP 10.30.0.2.3002 > 10.10.0.2.43429: . ack 29293 win 4068 <nop,nop,timestamp 177029 177035,nop,nop,sack 1 {31913:32961}>
07:02:29.930197 IP 10.10.0.2.43429 > 10.30.0.2.3002: . 29293:29817(524) ack 1 win 2920 <nop,nop,timestamp 177035 177029>
07:02:29.930276 IP 10.10.0.2.43429 > 10.30.0.2.3002: . 29817:30341(524) ack 1 win 2920 <nop,nop,timestamp 177035 177029>
07:02:29.930347 IP 10.30.0.2.3002 > 10.10.0.2.43429: . ack 29817 win 4592 <nop,nop,timestamp 177029 177035,nop,nop,sack 1 {31913:32961}>
07:02:29.930382 IP 10.30.0.2.3002 > 10.10.0.2.43429: . ack 30341 win 5116 <nop,nop,timestamp 177029 177035,nop,nop,sack 1 {31913:32961}>
07:02:29.930499 IP 10.10.0.2.43429 > 10.30.0.2.3002: . 30341:30865(524) ack 1 win 2920 <nop,nop,timestamp 177035 177029>
07:02:29.930598 IP 10.30.0.2.3002 > 10.10.0.2.43429: . ack 30865 win 5640 <nop,nop,timestamp 177029 177035,nop,nop,sack 1 {31913:32961}>
07:02:29.930621 IP 10.10.0.2.43429 > 10.30.0.2.3002: . 30865:31389(524) ack 1 win 2920 <nop,nop,timestamp 177035 177029>
07:02:29.930704 IP 10.30.0.2.3002 > 10.10.0.2.43429: . ack 31389 win 6164 <nop,nop,timestamp 177029 177035,nop,nop,sack 1 {31913:32961}>
07:02:29.930798 IP 10.10.0.2.43429 > 10.30.0.2.3002: . 32961:33485(524) ack 1 win 2920 <nop,nop,timestamp 177035 177029>
07:02:29.930885 IP 10.30.0.2.3002 > 10.10.0.2.43429: . ack 31389 win 6164 <nop,nop,timestamp 177029 177035,nop,nop,sack 1 {31913:33485}>
07:02:29.930926 IP 10.10.0.2.43429 > 10.30.0.2.3002: . 33485:34009(524) ack 1 win 2920 <nop,nop,timestamp 177035 177029>
07:02:29.931008 IP 10.30.0.2.3002 > 10.10.0.2.43429: . ack 31389 win 6164 <nop,nop,timestamp 177029 177035,nop,nop,sack 1 {31913:34009}>
07:02:29.936360 IP 10.10.0.2.43429 > 10.30.0.2.3002: . 31389:31913(524) ack 1 win 2920 <nop,nop,timestamp 177038 177029>
07:02:29.936373 IP 10.10.0.2.43429 > 10.30.0.2.3002: . 34009:34533(524) ack 1 win 2920 <nop,nop,timestamp 177038 177029>
07:02:29.936602 IP 10.30.0.2.3002 > 10.10.0.2.43429: . ack 34009 win 6688 <nop,nop,timestamp 177029 177038>
07:02:29.936636 IP 10.30.0.2.3002 > 10.10.0.2.43429: . ack 34533 win 7212 <nop,nop,timestamp 177029 177038>
07:02:29.936979 IP 10.10.0.2.43429 > 10.30.0.2.3002: . 34533:35057(524) ack 1 win 2920 <nop,nop,timestamp 177038 177029>
07:02:29.937139 IP 10.30.0.2.3002 > 10.10.0.2.43429: . ack 35057 win 7736 <nop,nop,timestamp 177029 177038>
07:02:29.937963 IP 10.10.0.2.43429 > 10.30.0.2.3002: . 35057:35581(524) ack 1 win 2920 <nop,nop,timestamp 177038 177029>
07:02:29.937984 IP 10.10.0.2.43429 > 10.30.0.2.3002: . 35581:36105(524) ack 1 win 2920 <nop,nop,timestamp 177038 177029>
07:02:29.938138 IP 10.30.0.2.3002 > 10.10.0.2.43429: . ack 35581 win 8260 <nop,nop,timestamp 177029 177038>
07:02:29.938649 IP 10.10.0.2.43429 > 10.30.0.2.3002: . 36105:36629(524) ack 1 win 2920 <nop,nop,timestamp 177038 177029>
07:02:29.938805 IP 10.30.0.2.3002 > 10.10.0.2.43429: . ack 36629 win 8260 <nop,nop,timestamp 177029 177038>
07:02:29.938928 IP 10.10.0.2.43429 > 10.30.0.2.3002: . 36629:37153(524) ack 1 win 2920 <nop,nop,timestamp 177038 177029>
07:02:29.939078 IP 10.10.0.2.43429 > 10.30.0.2.3002: . 37153:37677(524) ack 1 win 2920 <nop,nop,timestamp 177038 177029>
07:02:29.939231 IP 10.30.0.2.3002 > 10.10.0.2.43429: . ack 37677 win 8260 <nop,nop,timestamp 177029 177038>
07:02:29.939352 IP 10.10.0.2.43429 > 10.30.0.2.3002: . 37677:38201(524) ack 1 win 2920 <nop,nop,timestamp 177038 177029>
07:02:29.939812 IP 10.10.0.2.43429 > 10.30.0.2.3002: . 38201:38725(524) ack 1 win 2920 <nop,nop,timestamp 177038 177029>
07:02:29.939965 IP 10.10.0.2.43429 > 10.30.0.2.3002: . 38725:39249(524) ack 1 win 2920 <nop,nop,timestamp 177038 177029>
07:02:29.940116 IP 10.10.0.2.43429 > 10.30.0.2.3002: . 39249:39773(524) ack 1 win 2920 <nop,nop,timestamp 177038 177029>
07:02:29.940266 IP 10.10.0.2.43429 > 10.30.0.2.3002: . 39773:40297(524) ack 1 win 2920 <nop,nop,timestamp 177038 177029>
07:02:29.940416 IP 10.10.0.2.43429 > 10.30.0.2.3002: . 40297:40821(524) ack 1 win 2920 <nop,nop,timestamp 177038 177029>
07:02:29.940567 IP 10.10.0.2.43429 > 10.30.0.2.3002: . 40821:41345(524) ack 1 win 2920 <nop,nop,timestamp 177038 177029>
07:02:29.950738 IP 10.30.0.2.3002 > 10.10.0.2.43429: . ack 41345 win 6426 <nop,nop,timestamp 177034 177038>
07:02:29.951129 IP 10.10.0.2.43429 > 10.30.0.2.3002: P 41345:41869(524) ack 1 win 2920 <nop,nop,timestamp 177039 177034>
07:02:29.951153 IP 10.10.0.2.43429 > 10.30.0.2.3002: . 41869:42393(524) ack 1 win 2920 <nop,nop,timestamp 177039 177034>
07:02:29.951160 IP 10.10.0.2.43429 > 10.30.0.2.3002: . 42393:42917(524) ack 1 win 2920 <nop,nop,timestamp 177039 177034>
07:02:29.951166 IP 10.10.0.2.43429 > 10.30.0.2.3002: . 42917:43441(524) ack 1 win 2920 <nop,nop,timestamp 177039 177034>
07:02:29.951171 IP 10.10.0.2.43429 > 10.30.0.2.3002: . 43441:43965(524) ack 1 win 2920 <nop,nop,timestamp 177039 177034>
07:02:29.951177 IP 10.10.0.2.43429 > 10.30.0.2.3002: . 43965:44489(524) ack 1 win 2920 <nop,nop,timestamp 177039 177034>
07:02:29.951183 IP 10.10.0.2.43429 > 10.30.0.2.3002: . 44489:45013(524) ack 1 win 2920 <nop,nop,timestamp 177039 177034>
07:02:29.951189 IP 10.10.0.2.43429 > 10.30.0.2.3002: . 45013:45537(524) ack 1 win 2920 <nop,nop,timestamp 177039 177034>
07:02:29.993500 IP 10.30.0.2.3002 > 10.10.0.2.43429: . ack 45537 win 4330 <nop,nop,timestamp 177038 177039>
07:02:29.993942 IP 10.10.0.2.43429 > 10.30.0.2.3002: . 45537:46061(524) ack 1 win 2920 <nop,nop,timestamp 177044 177038>
07:02:29.994045 IP 10.30.0.2.3002 > 10.10.0.2.43429: . ack 46061 win 4068 <nop,nop,timestamp 177038 177044>
07:02:29.994154 IP 10.10.0.2.43429 > 10.30.0.2.3002: . 46061:46585(524) ack 1 win 2920 <nop,nop,timestamp 177044 177038>
07:02:29.994200 IP 10.10.0.2.43429 > 10.30.0.2.3002: . 46585:47109(524) ack 1 win 2920 <nop,nop,timestamp 177044 177038>
07:02:29.994220 IP 10.10.0.2.43429 > 10.30.0.2.3002: . 47109:47633(524) ack 1 win 2920 <nop,nop,timestamp 177044 177038>
07:02:29.994228 IP 10.10.0.2.43429 > 10.30.0.2.3002: . 47633:48157(524) ack 1 win 2920 <nop,nop,timestamp 177044 177038>
07:02:29.994247 IP 10.10.0.2.43429 > 10.30.0.2.3002: . 48157:48681(524) ack 1 win 2920 <nop,nop,timestamp 177044 177038>
07:02:29.994267 IP 10.10.0.2.43429 > 10.30.0.2.3002: . 48681:49205(524) ack 1 win 2920 <nop,nop,timestamp 177044 177038>
07:02:29.994274 IP 10.10.0.2.43429 > 10.30.0.2.3002: . 49205:49729(524) ack 1 win 2920 <nop,nop,timestamp 177044 177038>
07:02:29.994293 IP 10.10.0.2.43429 > 10.30.0.2.3002: . 49729:50253(524) ack 1 win 2920 <nop,nop,timestamp 177044 177038>
07:02:29.994433 IP 10.10.0.2.43429 > 10.30.0.2.3002: . 50253:50777(524) ack 1 win 2920 <nop,nop,timestamp 177044 177038>
07:02:29.994455 IP 10.10.0.2.43429 > 10.30.0.2.3002: . 50777:51301(524) ack 1 win 2920 <nop,nop,timestamp 177044 177038>
07:02:29.995161 IP 10.30.0.2.3002 > 10.10.0.2.43429: . ack 46585 win 3806 <nop,nop,timestamp 177038 177044>
07:02:29.995193 IP 10.30.0.2.3002 > 10.10.0.2.43429: . ack 47109 win 3544 <nop,nop,timestamp 177038 177044>
07:02:29.995216 IP 10.30.0.2.3002 > 10.10.0.2.43429: . ack 47633 win 4068 <nop,nop,timestamp 177038 177044>
07:02:29.995240 IP 10.30.0.2.3002 > 10.10.0.2.43429: . ack 48157 win 4592 <nop,nop,timestamp 177038 177044>
07:02:29.995264 IP 10.30.0.2.3002 > 10.10.0.2.43429: . ack 48681 win 5116 <nop,nop,timestamp 177038 177044>
07:02:29.995286 IP 10.30.0.2.3002 > 10.10.0.2.43429: . ack 49205 win 5640 <nop,nop,timestamp 177038 177044>
07:02:29.995309 IP 10.30.0.2.3002 > 10.10.0.2.43429: . ack 49729 win 6164 <nop,nop,timestamp 177038 177044>
07:02:29.995332 IP 10.30.0.2.3002 > 10.10.0.2.43429: . ack 50253 win 6688 <nop,nop,timestamp 177038 177044>
07:02:29.995412 IP 10.30.0.2.3002 > 10.10.0.2.43429: . ack 50777 win 7212 <nop,nop,timestamp 177038 177044>
07:02:29.995600 IP 10.10.0.2.43429 > 10.30.0.2.3002: . 51301:51825(524) ack 1 win 2920 <nop,nop,timestamp 177044 177038>
07:02:29.995625 IP 10.10.0.2.43429 > 10.30.0.2.3002: P 51825:52349(524) ack 1 win 2920 <nop,nop,timestamp 177044 177038>
07:02:29.996079 IP 10.10.0.2.43429 > 10.30.0.2.3002: . 52349:52873(524) ack 1 win 2920 <nop,nop,timestamp 177044 177038>
07:02:29.996126 IP 10.10.0.2.43429 > 10.30.0.2.3002: . 52873:53397(524) ack 1 win 2920 <nop,nop,timestamp 177044 177038>
07:02:29.996220 IP 10.10.0.2.43429 > 10.30.0.2.3002: . 53397:53921(524) ack 1 win 2920 <nop,nop,timestamp 177044 177038>
07:02:29.996238 IP 10.10.0.2.43429 > 10.30.0.2.3002: . 53921:54445(524) ack 1 win 2920 <nop,nop,timestamp 177044 177038>
07:02:29.996256 IP 10.10.0.2.43429 > 10.30.0.2.3002: . 54445:54969(524) ack 1 win 2920 <nop,nop,timestamp 177044 177038>
07:02:29.996279 IP 10.10.0.2.43429 > 10.30.0.2.3002: . 54969:55493(524) ack 1 win 2920 <nop,nop,timestamp 177044 177038>
07:02:29.996303 IP 10.10.0.2.43429 > 10.30.0.2.3002: . 55493:56017(524) ack 1 win 2920 <nop,nop,timestamp 177044 177038>
07:02:29.996322 IP 10.10.0.2.43429 > 10.30.0.2.3002: . 56017:56541(524) ack 1 win 2920 <nop,nop,timestamp 177044 177038>
07:02:29.996383 IP 10.10.0.2.43429 > 10.30.0.2.3002: . 56541:57065(524) ack 1 win 2920 <nop,nop,timestamp 177044 177038>
07:02:29.996392 IP 10.10.0.2.43429 > 10.30.0.2.3002: . 57065:57589(524) ack 1 win 2920 <nop,nop,timestamp 177044 177038>
07:02:30.033513 IP 10.30.0.2.3002 > 10.10.0.2.43429: . ack 57589 win 3806 <nop,nop,timestamp 177042 177044>
07:02:30.034297 IP 10.10.0.2.43429 > 10.30.0.2.3002: . 57589:58113(524) ack 1 win 2920 <nop,nop,timestamp 177048 177042>
07:02:30.034437 IP 10.10.0.2.43429 > 10.30.0.2.3002: . 58113:58637(524) ack 1 win 2920 <nop,nop,timestamp 177048 177042>
07:02:30.034504 IP 10.10.0.2.43429 > 10.30.0.2.3002: . 58637:59161(524) ack 1 win 2920 <nop,nop,timestamp 177048 177042>
07:02:30.034568 IP 10.10.0.2.43429 > 10.30.0.2.3002: . 59161:59685(524) ack 1 win 2920 <nop,nop,timestamp 177048 177042>
07:02:30.034631 IP 10.10.0.2.43429 > 10.30.0.2.3002: . 59685:60209(524) ack 1 win 2920 <nop,nop,timestamp 177048 177042>
07:02:30.034696 IP 10.10.0.2.43429 > 10.30.0.2.3002: P 60209:60733(524) ack 1 win 2920 <nop,nop,timestamp 177048 177042>
07:02:30.034762 IP 10.10.0.2.43429 > 10.30.0.2.3002: . 60733:61257(524) ack 1 win 2920 <nop,nop,timestamp 177048 177042>
07:02:30.034828 IP 10.10.0.2.43429 > 10.30.0.2.3002: . 61257:61781(524) ack 1 win 2920 <nop,nop,timestamp 177048 177042>
07:02:30.034838 IP 10.10.0.2.43429 > 10.30.0.2.3002: . 61781:62305(524) ack 1 win 2920 <nop,nop,timestamp 177048 177042>
07:02:30.034844 IP 10.10.0.2.43429 > 10.30.0.2.3002: . 62305:62829(524) ack 1 win 2920 <nop,nop,timestamp 177048 177042>
07:02:30.034851 IP 10.10.0.2.43429 > 10.30.0.2.3002: . 62829:63353(524) ack 1 win 2920 <nop,nop,timestamp 177048 177042>
07:02:30.034880 IP 10.30.0.2.3002 > 10.10.0.2.43429: . ack 58113 win 3544 <nop,nop,timestamp 177042 177048>
07:02:30.034909 IP 10.30.0.2.3002 > 10.10.0.2.43429: . ack 58637 win 3282 <nop,nop,timestamp 177042 177048>
07:02:30.034940 IP 10.30.0.2.3002 > 10.10.0.2.43429: . ack 59161 win 3020 <nop,nop,timestamp 177042 177048>
07:02:30.034964 IP 10.30.0.2.3002 > 10.10.0.2.43429: . ack 59685 win 3544 <nop,nop,timestamp 177042 177048>
07:02:30.034988 IP 10.30.0.2.3002 > 10.10.0.2.43429: . ack 60209 win 4068 <nop,nop,timestamp 177042 177048>
07:02:30.035010 IP 10.30.0.2.3002 > 10.10.0.2.43429: . ack 60733 win 4592 <nop,nop,timestamp 177042 177048>
07:02:30.035033 IP 10.30.0.2.3002 > 10.10.0.2.43429: . ack 61257 win 4976 <nop,nop,timestamp 177042 177048>
07:02:30.035914 IP 10.10.0.2.43429 > 10.30.0.2.3002: . 64401:64925(524) ack 1 win 2920 <nop,nop,timestamp 177048 177042>
07:02:30.036009 IP 10.10.0.2.43429 > 10.30.0.2.3002: . 64925:65449(524) ack 1 win 2920 <nop,nop,timestamp 177048 177042>
07:02:30.036085 IP 10.10.0.2.43429 > 10.30.0.2.3002: . 65449:65973(524) ack 1 win 2920 <nop,nop,timestamp 177048 177042>
07:02:30.036161 IP 10.10.0.2.43429 > 10.30.0.2.3002: . 65973:66497(524) ack 1 win 2920 <nop,nop,timestamp 177048 177042>
07:02:30.036237 IP 10.10.0.2.43429 > 10.30.0.2.3002: . 66497:67021(524) ack 1 win 2920 <nop,nop,timestamp 177048 177042>
07:02:30.036338 IP 10.10.0.2.43429 > 10.30.0.2.3002: . 67021:67545(524) ack 1 win 2920 <nop,nop,timestamp 177048 177042>
07:02:30.036348 IP 10.10.0.2.43429 > 10.30.0.2.3002: . 67545:68069(524) ack 1 win 2920 <nop,nop,timestamp 177048 177042>
07:02:30.036354 IP 10.10.0.2.43429 > 10.30.0.2.3002: P 68069:68593(524) ack 1 win 2920 <nop,nop,timestamp 177048 177042>
07:02:30.036366 IP 10.30.0.2.3002 > 10.10.0.2.43429: . ack 63353 win 3928 <nop,nop,timestamp 177042 177048,nop,nop,sack 1 {64401:64925}>
07:02:30.036394 IP 10.30.0.2.3002 > 10.10.0.2.43429: . ack 63353 win 3928 <nop,nop,timestamp 177042 177048,nop,nop,sack 1 {64401:65449}>
07:02:30.036417 IP 10.30.0.2.3002 > 10.10.0.2.43429: . ack 63353 win 3928 <nop,nop,timestamp 177042 177048,nop,nop,sack 1 {64401:65973}>
07:02:30.036454 IP 10.30.0.2.3002 > 10.10.0.2.43429: . ack 63353 win 3928 <nop,nop,timestamp 177042 177048,nop,nop,sack 1 {64401:66497}>
07:02:30.036501 IP 10.30.0.2.3002 > 10.10.0.2.43429: . ack 63353 win 3928 <nop,nop,timestamp 177042 177048,nop,nop,sack 1 {64401:67021}>
07:02:30.036526 IP 10.30.0.2.3002 > 10.10.0.2.43429: . ack 63353 win 3928 <nop,nop,timestamp 177042 177048,nop,nop,sack 1 {64401:67545}>
07:02:30.036549 IP 10.30.0.2.3002 > 10.10.0.2.43429: . ack 63353 win 3928 <nop,nop,timestamp 177042 177048,nop,nop,sack 1 {64401:68069}>
07:02:30.036600 IP 10.30.0.2.3002 > 10.10.0.2.43429: . ack 63353 win 3928 <nop,nop,timestamp 177042 177048,nop,nop,sack 1 {64401:68593}>
07:02:30.037974 IP 10.10.0.2.43429 > 10.30.0.2.3002: . 68593:69117(524) ack 1 win 2920 <nop,nop,timestamp 177048 177042>
07:02:30.038324 IP 10.10.0.2.43429 > 10.30.0.2.3002: . 69117:69641(524) ack 1 win 2920 <nop,nop,timestamp 177048 177042>
07:02:30.038593 IP 10.10.0.2.43429 > 10.30.0.2.3002: . 69641:70165(524) ack 1 win 2920 <nop,nop,timestamp 177048 177042>
07:02:30.038633 IP 10.10.0.2.43429 > 10.30.0.2.3002: . 63353:63877(524) ack 1 win 2920 <nop,nop,timestamp 177048 177042>
07:02:30.038669 IP 10.10.0.2.43429 > 10.30.0.2.3002: . 63877:64401(524) ack 1 win 2920 <nop,nop,timestamp 177048 177042>
07:02:30.038764 IP 10.10.0.2.43429 > 10.30.0.2.3002: . 70165:70689(524) ack 1 win 2920 <nop,nop,timestamp 177048 177042>
07:02:30.038860 IP 10.30.0.2.3002 > 10.10.0.2.43429: . ack 63353 win 3928 <nop,nop,timestamp 177042 177048,nop,nop,sack 1 {64401:69117}>
07:02:30.039006 IP 10.30.0.2.3002 > 10.10.0.2.43429: . ack 63353 win 3928 <nop,nop,timestamp 177042 177048,nop,nop,sack 1 {64401:69641}>
07:02:30.039096 IP 10.30.0.2.3002 > 10.10.0.2.43429: . ack 63353 win 3928 <nop,nop,timestamp 177042 177048,nop,nop,sack 1 {64401:70165}>
07:02:30.039182 IP 10.30.0.2.3002 > 10.10.0.2.43429: . ack 63877 win 3666 <nop,nop,timestamp 177042 177048,nop,nop,sack 1 {64401:70165}>
07:02:30.073637 IP 10.30.0.2.3002 > 10.10.0.2.43429: . ack 70689 win 260 <nop,nop,timestamp 177046 177048>
07:02:30.292140 IP 10.10.0.2.43429 > 10.30.0.2.3002: P 70689:71209(520) ack 1 win 2920 <nop,nop,timestamp 177074 177046>
07:02:30.292921 IP 10.30.0.2.3002 > 10.10.0.2.43429: . ack 71209 win 0 <nop,nop,timestamp 177067 177074>
07:02:30.512186 IP 10.10.0.2.43429 > 10.30.0.2.3002: . ack 1 win 2920 <nop,nop,timestamp 177096 177067>
07:02:30.513136 IP 10.30.0.2.3002 > 10.10.0.2.43429: . ack 71209 win 0 <nop,nop,timestamp 177089 177074>
07:02:30.952119 IP 10.10.0.2.43429 > 10.30.0.2.3002: . ack 1 win 2920 <nop,nop,timestamp 177140 177089>
07:02:30.953160 IP 10.30.0.2.3002 > 10.10.0.2.43429: . ack 71209 win 0 <nop,nop,timestamp 177133 177074>
07:02:31.832160 IP 10.10.0.2.43429 > 10.30.0.2.3002: . ack 1 win 2920 <nop,nop,timestamp 177228 177133>
07:02:31.832935 IP 10.30.0.2.3002 > 10.10.0.2.43429: . ack 71209 win 0 <nop,nop,timestamp 177221 177074>
07:02:31.913941 IP 10.30.0.2.3002 > 10.10.0.2.43429: . ack 71209 win 596 <nop,nop,timestamp 177230 177074>
07:02:31.915948 IP 10.10.0.2.43429 > 10.30.0.2.3002: P 71209:71213(4) ack 1 win 2920 <nop,nop,timestamp 177236 177230>
07:02:31.915995 IP 10.10.0.2.43429 > 10.30.0.2.3002: . 71213:71737(524) ack 1 win 2920 <nop,nop,timestamp 177236 177230>
07:02:31.916002 IP 10.10.0.2.43429 > 10.30.0.2.3002: . 71737:72261(524) ack 1 win 2920 <nop,nop,timestamp 177236 177230>
07:02:31.918378 IP 10.30.0.2.3002 > 10.10.0.2.43429: . ack 71213 win 594 <nop,nop,timestamp 177230 177236>
07:02:31.919359 IP 10.30.0.2.3002 > 10.10.0.2.43429: . ack 71737 win 1972 <nop,nop,timestamp 177230 177236>
07:02:31.919468 IP 10.30.0.2.3002 > 10.10.0.2.43429: . ack 72261 win 2496 <nop,nop,timestamp 177230 177236>
07:02:31.919887 IP 10.30.0.2.3002 > 10.10.0.2.43429: R 1:1(0) ack 72261 win 2496 <nop,nop,timestamp 177230 177236>
07:02:31.922356 IP 10.10.0.2.43429 > 10.30.0.2.3002: . 72261:72785(524) ack 1 win 2920 <nop,nop,timestamp 177236 177230>
07:02:31.922458 IP 10.10.0.2.43429 > 10.30.0.2.3002: . 72785:73309(524) ack 1 win 2920 <nop,nop,timestamp 177236 177230>
07:02:31.922537 IP 10.10.0.2.43429 > 10.30.0.2.3002: . 73309:73833(524) ack 1 win 2920 <nop,nop,timestamp 177236 177230>
07:02:31.922602 IP 10.10.0.2.43429 > 10.30.0.2.3002: . 73833:74357(524) ack 1 win 2920 <nop,nop,timestamp 177236 177230>
07:02:31.922665 IP 10.10.0.2.43429 > 10.30.0.2.3002: . 74357:74881(524) ack 1 win 2920 <nop,nop,timestamp 177236 177230>
07:02:31.922729 IP 10.10.0.2.43429 > 10.30.0.2.3002: . 74881:75405(524) ack 1 win 2920 <nop,nop,timestamp 177236 177230>
07:02:31.922813 IP 10.30.0.2.3002 > 10.10.0.2.43429: R 3719104287:3719104287(0) win 0
07:02:31.922950 IP 10.30.0.2.3002 > 10.10.0.2.43429: R 3719104287:3719104287(0) win 0
07:02:31.923078 IP 10.30.0.2.3002 > 10.10.0.2.43429: R 3719104287:3719104287(0) win 0
07:02:31.923206 IP 10.30.0.2.3002 > 10.10.0.2.43429: R 3719104287:3719104287(0) win 0
07:02:31.923334 IP 10.30.0.2.3002 > 10.10.0.2.43429: R 3719104287:3719104287(0) win 0
07:02:31.923460 IP 10.30.0.2.3002 > 10.10.0.2.43429: R 3719104287:3719104287(0) win 0
07:02:29.904850 IP 10.10.0.2.43429 > 10.30.0.2.3002: S 3712860313:3712860313(0) win 5840 <mss 1460,sackOK,timestamp 177030 0,nop,wscale 1>
07:02:29.906336 IP 10.30.0.2.3002 > 10.10.0.2.43429: S 3719104286:3719104286(0) ack 3712860314 win 5792 <mss 536,sackOK,timestamp 177029 177030,nop,wscale 1>
07:02:29.908496 IP 10.10.0.2.43429 > 10.30.0.2.3002: . ack 1 win 2920 <nop,nop,timestamp 177035 177029>
07:02:29.909589 IP 10.10.0.2.43429 > 10.30.0.2.3002: . 1:525(524) ack 1 win 2920 <nop,nop,timestamp 177035 177029>
07:02:29.910283 IP 10.10.0.2.43429 > 10.30.0.2.3002: . 525:1049(524) ack 1 win 2920 <nop,nop,timestamp 177035 177029>
07:02:29.910324 IP 10.10.0.2.43429 > 10.30.0.2.3002: . 1049:1573(524) ack 1 win 2920 <nop,nop,timestamp 177035 177029>
07:02:29.910368 IP 10.30.0.2.3002 > 10.10.0.2.43429: . ack 525 win 3420 <nop,nop,timestamp 177029 177035>
07:02:29.910544 IP 10.10.0.2.43429 > 10.30.0.2.3002: . 1573:2097(524) ack 1 win 2920 <nop,nop,timestamp 177035 177029>
07:02:29.911448 IP 10.30.0.2.3002 > 10.10.0.2.43429: . ack 1049 win 3944 <nop,nop,timestamp 177029 177035>
07:02:29.911483 IP 10.30.0.2.3002 > 10.10.0.2.43429: . ack 1573 win 4468 <nop,nop,timestamp 177029 177035>
07:02:29.911511 IP 10.30.0.2.3002 > 10.10.0.2.43429: . ack 2097 win 4992 <nop,nop,timestamp 177029 177035>
07:02:29.911763 IP 10.10.0.2.43429 > 10.30.0.2.3002: . 2097:2621(524) ack 1 win 2920 <nop,nop,timestamp 177035 177029>
07:02:29.912186 IP 10.30.0.2.3002 > 10.10.0.2.43429: . ack 2621 win 5516 <nop,nop,timestamp 177029 177035>
07:02:29.913895 IP 10.10.0.2.43429 > 10.30.0.2.3002: P 2621:3145(524) ack 1 win 2920 <nop,nop,timestamp 177035 177029>
07:02:29.914507 IP 10.10.0.2.43429 > 10.30.0.2.3002: . 3145:3669(524) ack 1 win 2920 <nop,nop,timestamp 177035 177029>
07:02:29.915070 IP 10.30.0.2.3002 > 10.10.0.2.43429: . ack 3145 win 6040 <nop,nop,timestamp 177029 177035>
07:02:29.915167 IP 10.10.0.2.43429 > 10.30.0.2.3002: . 3669:4193(524) ack 1 win 2920 <nop,nop,timestamp 177035 177029>
07:02:29.917083 IP 10.30.0.2.3002 > 10.10.0.2.43429: . ack 3669 win 6564 <nop,nop,timestamp 177029 177035>
07:02:29.917108 IP 10.10.0.2.43429 > 10.30.0.2.3002: . 4193:4717(524) ack 1 win 2920 <nop,nop,timestamp 177035 177029>
07:02:29.917200 IP 10.10.0.2.43429 > 10.30.0.2.3002: . 4717:5241(524) ack 1 win 2920 <nop,nop,timestamp 177035 177029>
07:02:29.917279 IP 10.10.0.2.43429 > 10.30.0.2.3002: . 5241:5765(524) ack 1 win 2920 <nop,nop,timestamp 177035 177029>
07:02:29.917367 IP 10.10.0.2.43429 > 10.30.0.2.3002: P 5765:6289(524) ack 1 win 2920 <nop,nop,timestamp 177035 177029>
07:02:29.920587 IP 10.30.0.2.3002 > 10.10.0.2.43429: . ack 4193 win 7088 <nop,nop,timestamp 177029 177035>
07:02:29.920607 IP 10.30.0.2.3002 > 10.10.0.2.43429: . ack 4717 win 7612 <nop,nop,timestamp 177029 177035>
07:02:29.920617 IP 10.30.0.2.3002 > 10.10.0.2.43429: . ack 5241 win 8136 <nop,nop,timestamp 177029 177035>
07:02:29.920635 IP 10.10.0.2.43429 > 10.30.0.2.3002: . 6289:6813(524) ack 1 win 2920 <nop,nop,timestamp 177035 177029>
07:02:29.920799 IP 10.30.0.2.3002 > 10.10.0.2.43429: . ack 5765 win 8660 <nop,nop,timestamp 177029 177035>
07:02:29.920827 IP 10.10.0.2.43429 > 10.30.0.2.3002: . 6813:7337(524) ack 1 win 2920 <nop,nop,timestamp 177035 177029>
07:02:29.920912 IP 10.10.0.2.43429 > 10.30.0.2.3002: . 7337:7861(524) ack 1 win 2920 <nop,nop,timestamp 177035 177029>
07:02:29.920998 IP 10.10.0.2.43429 > 10.30.0.2.3002: P 7861:8193(332) ack 1 win 2920 <nop,nop,timestamp 177035 177029>
07:02:29.921046 IP 10.10.0.2.43429 > 10.30.0.2.3002: . 8193:8717(524) ack 1 win 2920 <nop,nop,timestamp 177035 177029>
07:02:29.921130 IP 10.10.0.2.43429 > 10.30.0.2.3002: . 8717:9241(524) ack 1 win 2920 <nop,nop,timestamp 177035 177029>
07:02:29.921183 IP 10.30.0.2.3002 > 10.10.0.2.43429: . ack 6289 win 8660 <nop,nop,timestamp 177029 177035>
07:02:29.921209 IP 10.30.0.2.3002 > 10.10.0.2.43429: . ack 6813 win 8660 <nop,nop,timestamp 177029 177035>
07:02:29.921232 IP 10.30.0.2.3002 > 10.10.0.2.43429: . ack 7337 win 8660 <nop,nop,timestamp 177029 177035>
07:02:29.921256 IP 10.30.0.2.3002 > 10.10.0.2.43429: . ack 7861 win 8660 <nop,nop,timestamp 177029 177035>
07:02:29.921280 IP 10.30.0.2.3002 > 10.10.0.2.43429: . ack 8717 win 8660 <nop,nop,timestamp 177029 177035>
07:02:29.921369 IP 10.10.0.2.43429 > 10.30.0.2.3002: . 9241:9765(524) ack 1 win 2920 <nop,nop,timestamp 177035 177029>
07:02:29.921458 IP 10.10.0.2.43429 > 10.30.0.2.3002: . 9765:10289(524) ack 1 win 2920 <nop,nop,timestamp 177035 177029>
07:02:29.921505 IP 10.10.0.2.43429 > 10.30.0.2.3002: . 10289:10813(524) ack 1 win 2920 <nop,nop,timestamp 177035 177029>
07:02:29.921587 IP 10.10.0.2.43429 > 10.30.0.2.3002: . 10813:11337(524) ack 1 win 2920 <nop,nop,timestamp 177035 177029>
07:02:29.921635 IP 10.10.0.2.43429 > 10.30.0.2.3002: . 11337:11861(524) ack 1 win 2920 <nop,nop,timestamp 177035 177029>
07:02:29.921717 IP 10.10.0.2.43429 > 10.30.0.2.3002: . 11861:12385(524) ack 1 win 2920 <nop,nop,timestamp 177035 177029>
07:02:29.921764 IP 10.10.0.2.43429 > 10.30.0.2.3002: P 12385:12909(524) ack 1 win 2920 <nop,nop,timestamp 177035 177029>
07:02:29.921846 IP 10.10.0.2.43429 > 10.30.0.2.3002: . 12909:13433(524) ack 1 win 2920 <nop,nop,timestamp 177035 177029>
07:02:29.921900 IP 10.30.0.2.3002 > 10.10.0.2.43429: . ack 9765 win 8660 <nop,nop,timestamp 177029 177035>
07:02:29.921930 IP 10.30.0.2.3002 > 10.10.0.2.43429: . ack 10813 win 8660 <nop,nop,timestamp 177029 177035>
07:02:29.921955 IP 10.30.0.2.3002 > 10.10.0.2.43429: . ack 11861 win 8660 <nop,nop,timestamp 177029 177035>
07:02:29.921979 IP 10.30.0.2.3002 > 10.10.0.2.43429: . ack 12909 win 8660 <nop,nop,timestamp 177029 177035>
07:02:29.923226 IP 10.10.0.2.43429 > 10.30.0.2.3002: . 13433:13957(524) ack 1 win 2920 <nop,nop,timestamp 177035 177029>
07:02:29.923328 IP 10.10.0.2.43429 > 10.30.0.2.3002: . 13957:14481(524) ack 1 win 2920 <nop,nop,timestamp 177035 177029>
07:02:29.923377 IP 10.10.0.2.43429 > 10.30.0.2.3002: . 14481:15005(524) ack 1 win 2920 <nop,nop,timestamp 177035 177029>
07:02:29.923452 IP 10.10.0.2.43429 > 10.30.0.2.3002: . 15005:15529(524) ack 1 win 2920 <nop,nop,timestamp 177035 177029>
07:02:29.923498 IP 10.10.0.2.43429 > 10.30.0.2.3002: . 15529:16053(524) ack 1 win 2920 <nop,nop,timestamp 177035 177029>
07:02:29.923568 IP 10.10.0.2.43429 > 10.30.0.2.3002: . 16053:16577(524) ack 1 win 2920 <nop,nop,timestamp 177035 177029>
07:02:29.923622 IP 10.30.0.2.3002 > 10.10.0.2.43429: . ack 13957 win 8660 <nop,nop,timestamp 177029 177035>
07:02:29.923663 IP 10.10.0.2.43429 > 10.30.0.2.3002: . 16577:17101(524) ack 1 win 2920 <nop,nop,timestamp 177035 177029>
07:02:29.923732 IP 10.10.0.2.43429 > 10.30.0.2.3002: . 17101:17625(524) ack 1 win 2920 <nop,nop,timestamp 177035 177029>
07:02:29.923779 IP 10.10.0.2.43429 > 10.30.0.2.3002: . 17625:18149(524) ack 1 win 2920 <nop,nop,timestamp 177035 177029>
07:02:29.923848 IP 10.10.0.2.43429 > 10.30.0.2.3002: . 18149:18673(524) ack 1 win 2920 <nop,nop,timestamp 177035 177029>
07:02:29.923895 IP 10.10.0.2.43429 > 10.30.0.2.3002: . 18673:19197(524) ack 1 win 2920 <nop,nop,timestamp 177035 177029>
07:02:29.923972 IP 10.30.0.2.3002 > 10.10.0.2.43429: . ack 15005 win 8660 <nop,nop,timestamp 177029 177035>
07:02:29.923997 IP 10.30.0.2.3002 > 10.10.0.2.43429: . ack 16053 win 8660 <nop,nop,timestamp 177029 177035>
07:02:29.924032 IP 10.30.0.2.3002 > 10.10.0.2.43429: . ack 17101 win 8660 <nop,nop,timestamp 177029 177035>
07:02:29.924057 IP 10.30.0.2.3002 > 10.10.0.2.43429: . ack 18149 win 8660 <nop,nop,timestamp 177029 177035>
07:02:29.924081 IP 10.30.0.2.3002 > 10.10.0.2.43429: . ack 19197 win 8660 <nop,nop,timestamp 177029 177035>
07:02:29.925217 IP 10.10.0.2.43429 > 10.30.0.2.3002: . 23913:24437(524) ack 1 win 2920 <nop,nop,timestamp 177035 177029>
07:02:29.925307 IP 10.10.0.2.43429 > 10.30.0.2.3002: P 24437:24577(140) ack 1 win 2920 <nop,nop,timestamp 177035 177029>
07:02:29.925381 IP 10.10.0.2.43429 > 10.30.0.2.3002: . 24577:25101(524) ack 1 win 2920 <nop,nop,timestamp 177035 177029>
07:02:29.925446 IP 10.10.0.2.43429 > 10.30.0.2.3002: . 25101:25625(524) ack 1 win 2920 <nop,nop,timestamp 177035 177029>
07:02:29.925516 IP 10.10.0.2.43429 > 10.30.0.2.3002: . 25625:26149(524) ack 1 win 2920 <nop,nop,timestamp 177035 177029>
07:02:29.925580 IP 10.10.0.2.43429 > 10.30.0.2.3002: . 26149:26673(524) ack 1 win 2920 <nop,nop,timestamp 177035 177029>
07:02:29.925698 IP 10.30.0.2.3002 > 10.10.0.2.43429: . ack 19197 win 8660 <nop,nop,timestamp 177029 177035,nop,nop,sack 1 {23913:24437}>
07:02:29.925743 IP 10.10.0.2.43429 > 10.30.0.2.3002: . 26673:27197(524) ack 1 win 2920 <nop,nop,timestamp 177035 177029>
07:02:29.925814 IP 10.10.0.2.43429 > 10.30.0.2.3002: . 27197:27721(524) ack 1 win 2920 <nop,nop,timestamp 177035 177029>
07:02:29.925890 IP 10.10.0.2.43429 > 10.30.0.2.3002: . 27721:28245(524) ack 1 win 2920 <nop,nop,timestamp 177035 177029>
07:02:29.925956 IP 10.10.0.2.43429 > 10.30.0.2.3002: . 28245:28769(524) ack 1 win 2920 <nop,nop,timestamp 177035 177029>
07:02:29.926026 IP 10.10.0.2.43429 > 10.30.0.2.3002: . 28769:29293(524) ack 1 win 2920 <nop,nop,timestamp 177035 177029>
07:02:29.926097 IP 10.30.0.2.3002 > 10.10.0.2.43429: . ack 19197 win 8660 <nop,nop,timestamp 177029 177035,nop,nop,sack 1 {23913:24577}>
07:02:29.926122 IP 10.30.0.2.3002 > 10.10.0.2.43429: . ack 19197 win 8660 <nop,nop,timestamp 177029 177035,nop,nop,sack 1 {23913:25101}>
07:02:29.926147 IP 10.30.0.2.3002 > 10.10.0.2.43429: . ack 19197 win 8660 <nop,nop,timestamp 177029 177035,nop,nop,sack 1 {23913:25625}>
07:02:29.926162 IP 10.30.0.2.3002 > 10.10.0.2.43429: . ack 19197 win 8660 <nop,nop,timestamp 177029 177035,nop,nop,sack 1 {23913:26149}>
07:02:29.926193 IP 10.30.0.2.3002 > 10.10.0.2.43429: . ack 19197 win 8660 <nop,nop,timestamp 177029 177035,nop,nop,sack 1 {23913:26673}>
07:02:29.926225 IP 10.10.0.2.43429 > 10.30.0.2.3002: . 19197:19721(524) ack 1 win 2920 <nop,nop,timestamp 177035 177029>
07:02:29.926303 IP 10.30.0.2.3002 > 10.10.0.2.43429: . ack 19197 win 8660 <nop,nop,timestamp 177029 177035,nop,nop,sack 1 {23913:27197}>
07:02:29.926328 IP 10.30.0.2.3002 > 10.10.0.2.43429: . ack 19197 win 8660 <nop,nop,timestamp 177029 177035,nop,nop,sack 1 {23913:27721}>
07:02:29.926353 IP 10.30.0.2.3002 > 10.10.0.2.43429: . ack 19197 win 8660 <nop,nop,timestamp 177029 177035,nop,nop,sack 1 {23913:28245}>
07:02:29.926378 IP 10.30.0.2.3002 > 10.10.0.2.43429: . ack 19197 win 8660 <nop,nop,timestamp 177029 177035,nop,nop,sack 1 {23913:28769}>
07:02:29.926403 IP 10.30.0.2.3002 > 10.10.0.2.43429: . ack 19197 win 8660 <nop,nop,timestamp 177029 177035,nop,nop,sack 1 {23913:29293}>
07:02:29.926433 IP 10.30.0.2.3002 > 10.10.0.2.43429: . ack 19721 win 8398 <nop,nop,timestamp 177029 177035,nop,nop,sack 1 {23913:29293}>
07:02:29.927399 IP 10.10.0.2.43429 > 10.30.0.2.3002: . 19721:20245(524) ack 1 win 2920 <nop,nop,timestamp 177035 177029>
07:02:29.927503 IP 10.10.0.2.43429 > 10.30.0.2.3002: . 20245:20769(524) ack 1 win 2920 <nop,nop,timestamp 177035 177029>
07:02:29.927587 IP 10.10.0.2.43429 > 10.30.0.2.3002: P 20769:21293(524) ack 1 win 2920 <nop,nop,timestamp 177035 177029>
07:02:29.927663 IP 10.10.0.2.43429 > 10.30.0.2.3002: . 21293:21817(524) ack 1 win 2920 <nop,nop,timestamp 177035 177029>
07:02:29.927813 IP 10.10.0.2.43429 > 10.30.0.2.3002: . 21817:22341(524) ack 1 win 2920 <nop,nop,timestamp 177035 177029>
07:02:29.927915 IP 10.30.0.2.3002 > 10.10.0.2.43429: . ack 20245 win 8136 <nop,nop,timestamp 177029 177035,nop,nop,sack 1 {23913:29293}>
07:02:29.927944 IP 10.10.0.2.43429 > 10.30.0.2.3002: . 22341:22865(524) ack 1 win 2920 <nop,nop,timestamp 177035 177029>
07:02:29.928027 IP 10.30.0.2.3002 > 10.10.0.2.43429: . ack 20769 win 7874 <nop,nop,timestamp 177029 177035,nop,nop,sack 1 {23913:29293}>
07:02:29.928053 IP 10.30.0.2.3002 > 10.10.0.2.43429: . ack 21293 win 7612 <nop,nop,timestamp 177029 177035,nop,nop,sack 1 {23913:29293}>
07:02:29.928076 IP 10.30.0.2.3002 > 10.10.0.2.43429: . ack 21817 win 7350 <nop,nop,timestamp 177029 177035,nop,nop,sack 1 {23913:29293}>
07:02:29.928100 IP 10.30.0.2.3002 > 10.10.0.2.43429: . ack 22341 win 7088 <nop,nop,timestamp 177029 177035,nop,nop,sack 1 {23913:29293}>
07:02:29.928125 IP 10.30.0.2.3002 > 10.10.0.2.43429: . ack 22865 win 6826 <nop,nop,timestamp 177029 177035,nop,nop,sack 1 {23913:29293}>
07:02:29.928147 IP 10.10.0.2.43429 > 10.30.0.2.3002: . 22865:23389(524) ack 1 win 2920 <nop,nop,timestamp 177035 177029>
07:02:29.928230 IP 10.30.0.2.3002 > 10.10.0.2.43429: . ack 23389 win 6564 <nop,nop,timestamp 177029 177035,nop,nop,sack 1 {23913:29293}>
07:02:29.928345 IP 10.10.0.2.43429 > 10.30.0.2.3002: . 23389:23913(524) ack 1 win 2920 <nop,nop,timestamp 177035 177029>
07:02:29.928432 IP 10.30.0.2.3002 > 10.10.0.2.43429: . ack 29293 win 4068 <nop,nop,timestamp 177029 177035>
07:02:29.929763 IP 10.10.0.2.43429 > 10.30.0.2.3002: . 31913:32437(524) ack 1 win 2920 <nop,nop,timestamp 177035 177029>
07:02:29.929856 IP 10.10.0.2.43429 > 10.30.0.2.3002: . 32437:32961(524) ack 1 win 2920 <nop,nop,timestamp 177035 177029>
07:02:29.929941 IP 10.30.0.2.3002 > 10.10.0.2.43429: . ack 29293 win 4068 <nop,nop,timestamp 177029 177035,nop,nop,sack 1 {31913:32437}>
07:02:29.929970 IP 10.30.0.2.3002 > 10.10.0.2.43429: . ack 29293 win 4068 <nop,nop,timestamp 177029 177035,nop,nop,sack 1 {31913:32961}>
07:02:29.930197 IP 10.10.0.2.43429 > 10.30.0.2.3002: . 29293:29817(524) ack 1 win 2920 <nop,nop,timestamp 177035 177029>
07:02:29.930276 IP 10.10.0.2.43429 > 10.30.0.2.3002: . 29817:30341(524) ack 1 win 2920 <nop,nop,timestamp 177035 177029>
07:02:29.930347 IP 10.30.0.2.3002 > 10.10.0.2.43429: . ack 29817 win 4592 <nop,nop,timestamp 177029 177035,nop,nop,sack 1 {31913:32961}>
07:02:29.930382 IP 10.30.0.2.3002 > 10.10.0.2.43429: . ack 30341 win 5116 <nop,nop,timestamp 177029 177035,nop,nop,sack 1 {31913:32961}>
07:02:29.930499 IP 10.10.0.2.43429 > 10.30.0.2.3002: . 30341:30865(524) ack 1 win 2920 <nop,nop,timestamp 177035 177029>
07:02:29.930598 IP 10.30.0.2.3002 > 10.10.0.2.43429: . ack 30865 win 5640 <nop,nop,timestamp 177029 177035,nop,nop,sack 1 {31913:32961}>
07:02:29.930621 IP 10.10.0.2.43429 > 10.30.0.2.3002: . 30865:31389(524) ack 1 win 2920 <nop,nop,timestamp 177035 177029>
07:02:29.930704 IP 10.30.0.2.3002 > 10.10.0.2.43429: . ack 31389 win 6164 <nop,nop,timestamp 177029 177035,nop,nop,sack 1 {31913:32961}>
07:02:29.930798 IP 10.10.0.2.43429 > 10.30.0.2.3002: . 32961:33485(524) ack 1 win 2920 <nop,nop,timestamp 177035 177029>
07:02:29.930885 IP 10.30.0.2.3002 > 10.10.0.2.43429: . ack 31389 win 6164 <nop,nop,timestamp 177029 177035,nop,nop,sack 1 {31913:33485}>
07:02:29.930926 IP 10.10.0.2.43429 > 10.30.0.2.3002: . 33485:34009(524) ack 1 win 2920 <nop,nop,timestamp 177035 177029>
07:02:29.931008 IP 10.30.0.2.3002 > 10.10.0.2.43429: . ack 31389 win 6164 <nop,nop,timestamp 177029 177035,nop,nop,sack 1 {31913:34009}>
07:02:29.936360 IP 10.10.0.2.43429 > 10.30.0.2.3002: . 31389:31913(524) ack 1 win 2920 <nop,nop,timestamp 177038 177029>
07:02:29.936373 IP 10.10.0.2.43429 > 10.30.0.2.3002: . 34009:34533(524) ack 1 win 2920 <nop,nop,timestamp 177038 177029>
07:02:29.936602 IP 10.30.0.2.3002 > 10.10.0.2.43429: . ack 34009 win 6688 <nop,nop,timestamp 177029 177038>
07:02:29.936636 IP 10.30.0.2.3002 > 10.10.0.2.43429: . ack 34533 win 7212 <nop,nop,timestamp 177029 177038>
07:02:29.936979 IP 10.10.0.2.43429 > 10.30.0.2.3002: . 34533:35057(524) ack 1 win 2920 <nop,nop,timestamp 177038 177029>
07:02:29.937139 IP 10.30.0.2.3002 > 10.10.0.2.43429: . ack 35057 win 7736 <nop,nop,timestamp 177029 177038>
07:02:29.937963 IP 10.10.0.2.43429 > 10.30.0.2.3002: . 35057:35581(524) ack 1 win 2920 <nop,nop,timestamp 177038 177029>
07:02:29.937984 IP 10.10.0.2.43429 > 10.30.0.2.3002: . 35581:36105(524) ack 1 win 2920 <nop,nop,timestamp 177038 177029>
07:02:29.938138 IP 10.30.0.2.3002 > 10.10.0.2.43429: . ack 35581 win 8260 <nop,nop,timestamp 177029 177038>
07:02:29.938649 IP 10.10.0.2.43429 > 10.30.0.2.3002: . 36105:36629(524) ack 1 win 2920 <nop,nop,timestamp 177038 177029>
07:02:29.938805 IP 10.30.0.2.3002 > 10.10.0.2.43429: . ack 36629 win 8260 <nop,nop,timestamp 177029 177038>
07:02:29.938928 IP 10.10.0.2.43429 > 10.30.0.2.3002: . 36629:37153(524) ack 1 win 2920 <nop,nop,timestamp 177038 177029>
07:02:29.939078 IP 10.10.0.2.43429 > 10.30.0.2.3002: . 37153:37677(524) ack 1 win 2920 <nop,nop,timestamp 177038 177029>
07:02:29.939231 IP 10.30.0.2.3002 > 10.10.0.2.43429: . ack 37677 win 8260 <nop,nop,timestamp 177029 177038>
07:02:29.939352 IP 10.10.0.2.43429 > 10.30.0.2.3002: . 37677:38201(524) ack 1 win 2920 <nop,nop,timestamp 177038 177029>
07:02:29.939812 IP 10.10.0.2.43429 > 10.30.0.2.3002: . 38201:38725(524) ack 1 win 2920 <nop,nop,timestamp 177038 177029>
07:02:29.939965 IP 10.10.0.2.43429 > 10.30.0.2.3002: . 38725:39249(524) ack 1 win 2920 <nop,nop,timestamp 177038 177029>
07:02:29.940116 IP 10.10.0.2.43429 > 10.30.0.2.3002: . 39249:39773(524) ack 1 win 2920 <nop,nop,timestamp 177038 177029>
07:02:29.940266 IP 10.10.0.2.43429 > 10.30.0.2.3002: . 39773:40297(524) ack 1 win 2920 <nop,nop,timestamp 177038 177029>
07:02:29.940416 IP 10.10.0.2.43429 > 10.30.0.2.3002: . 40297:40821(524) ack 1 win 2920 <nop,nop,timestamp 177038 177029>
07:02:29.940567 IP 10.10.0.2.43429 > 10.30.0.2.3002: . 40821:41345(524) ack 1 win 2920 <nop,nop,timestamp 177038 177029>
07:02:29.950738 IP 10.30.0.2.3002 > 10.10.0.2.43429: . ack 41345 win 6426 <nop,nop,timestamp 177034 177038>
07:02:29.951129 IP 10.10.0.2.43429 > 10.30.0.2.3002: P 41345:41869(524) ack 1 win 2920 <nop,nop,timestamp 177039 177034>
07:02:29.951153 IP 10.10.0.2.43429 > 10.30.0.2.3002: . 41869:42393(524) ack 1 win 2920 <nop,nop,timestamp 177039 177034>
07:02:29.951160 IP 10.10.0.2.43429 > 10.30.0.2.3002: . 42393:42917(524) ack 1 win 2920 <nop,nop,timestamp 177039 177034>
07:02:29.951166 IP 10.10.0.2.43429 > 10.30.0.2.3002: . 42917:43441(524) ack 1 win 2920 <nop,nop,timestamp 177039 177034>
07:02:29.951171 IP 10.10.0.2.43429 > 10.30.0.2.3002: . 43441:43965(524) ack 1 win 2920 <nop,nop,timestamp 177039 177034>
07:02:29.951177 IP 10.10.0.2.43429 > 10.30.0.2.3002: . 43965:44489(524) ack 1 win 2920 <nop,nop,timestamp 177039 177034>
07:02:29.951183 IP 10.10.0.2.43429 > 10.30.0.2.3002: . 44489:45013(524) ack 1 win 2920 <nop,nop,timestamp 177039 177034>
07:02:29.951189 IP 10.10.0.2.43429 > 10.30.0.2.3002: . 45013:45537(524) ack 1 win 2920 <nop,nop,timestamp 177039 177034>
07:02:29.993500 IP 10.30.0.2.3002 > 10.10.0.2.43429: . ack 45537 win 4330 <nop,nop,timestamp 177038 177039>
07:02:29.993942 IP 10.10.0.2.43429 > 10.30.0.2.3002: . 45537:46061(524) ack 1 win 2920 <nop,nop,timestamp 177044 177038>
07:02:29.994045 IP 10.30.0.2.3002 > 10.10.0.2.43429: . ack 46061 win 4068 <nop,nop,timestamp 177038 177044>
07:02:29.994154 IP 10.10.0.2.43429 > 10.30.0.2.3002: . 46061:46585(524) ack 1 win 2920 <nop,nop,timestamp 177044 177038>
07:02:29.994200 IP 10.10.0.2.43429 > 10.30.0.2.3002: . 46585:47109(524) ack 1 win 2920 <nop,nop,timestamp 177044 177038>
07:02:29.994220 IP 10.10.0.2.43429 > 10.30.0.2.3002: . 47109:47633(524) ack 1 win 2920 <nop,nop,timestamp 177044 177038>
07:02:29.994228 IP 10.10.0.2.43429 > 10.30.0.2.3002: . 47633:48157(524) ack 1 win 2920 <nop,nop,timestamp 177044 177038>
07:02:29.994247 IP 10.10.0.2.43429 > 10.30.0.2.3002: . 48157:48681(524) ack 1 win 2920 <nop,nop,timestamp 177044 177038>
07:02:29.994267 IP 10.10.0.2.43429 > 10.30.0.2.3002: . 48681:49205(524) ack 1 win 2920 <nop,nop,timestamp 177044 177038>
07:02:29.994274 IP 10.10.0.2.43429 > 10.30.0.2.3002: . 49205:49729(524) ack 1 win 2920 <nop,nop,timestamp 177044 177038>
07:02:29.994293 IP 10.10.0.2.43429 > 10.30.0.2.3002: . 49729:50253(524) ack 1 win 2920 <nop,nop,timestamp 177044 177038>
07:02:29.994433 IP 10.10.0.2.43429 > 10.30.0.2.3002: . 50253:50777(524) ack 1 win 2920 <nop,nop,timestamp 177044 177038>
07:02:29.994455 IP 10.10.0.2.43429 > 10.30.0.2.3002: . 50777:51301(524) ack 1 win 2920 <nop,nop,timestamp 177044 177038>
07:02:29.995161 IP 10.30.0.2.3002 > 10.10.0.2.43429: . ack 46585 win 3806 <nop,nop,timestamp 177038 177044>
07:02:29.995193 IP 10.30.0.2.3002 > 10.10.0.2.43429: . ack 47109 win 3544 <nop,nop,timestamp 177038 177044>
07:02:29.995216 IP 10.30.0.2.3002 > 10.10.0.2.43429: . ack 47633 win 4068 <nop,nop,timestamp 177038 177044>
07:02:29.995240 IP 10.30.0.2.3002 > 10.10.0.2.43429: . ack 48157 win 4592 <nop,nop,timestamp 177038 177044>
07:02:29.995264 IP 10.30.0.2.3002 > 10.10.0.2.43429: . ack 48681 win 5116 <nop,nop,timestamp 177038 177044>
07:02:29.995286 IP 10.30.0.2.3002 > 10.10.0.2.43429: . ack 49205 win 5640 <nop,nop,timestamp 177038 177044>
07:02:29.995309 IP 10.30.0.2.3002 > 10.10.0.2.43429: . ack 49729 win 6164 <nop,nop,timestamp 177038 177044>
07:02:29.995332 IP 10.30.0.2.3002 > 10.10.0.2.43429: . ack 50253 win 6688 <nop,nop,timestamp 177038 177044>
07:02:29.995412 IP 10.30.0.2.3002 > 10.10.0.2.43429: . ack 50777 win 7212 <nop,nop,timestamp 177038 177044>
07:02:29.995600 IP 10.10.0.2.43429 > 10.30.0.2.3002: . 51301:51825(524) ack 1 win 2920 <nop,nop,timestamp 177044 177038>
07:02:29.995625 IP 10.10.0.2.43429 > 10.30.0.2.3002: P 51825:52349(524) ack 1 win 2920 <nop,nop,timestamp 177044 177038>
07:02:29.996079 IP 10.10.0.2.43429 > 10.30.0.2.3002: . 52349:52873(524) ack 1 win 2920 <nop,nop,timestamp 177044 177038>
07:02:29.996126 IP 10.10.0.2.43429 > 10.30.0.2.3002: . 52873:53397(524) ack 1 win 2920 <nop,nop,timestamp 177044 177038>
07:02:29.996220 IP 10.10.0.2.43429 > 10.30.0.2.3002: . 53397:53921(524) ack 1 win 2920 <nop,nop,timestamp 177044 177038>
07:02:29.996238 IP 10.10.0.2.43429 > 10.30.0.2.3002: . 53921:54445(524) ack 1 win 2920 <nop,nop,timestamp 177044 177038>
07:02:29.996256 IP 10.10.0.2.43429 > 10.30.0.2.3002: . 54445:54969(524) ack 1 win 2920 <nop,nop,timestamp 177044 177038>
07:02:29.996279 IP 10.10.0.2.43429 > 10.30.0.2.3002: . 54969:55493(524) ack 1 win 2920 <nop,nop,timestamp 177044 177038>
07:02:29.996303 IP 10.10.0.2.43429 > 10.30.0.2.3002: . 55493:56017(524) ack 1 win 2920 <nop,nop,timestamp 177044 177038>
07:02:29.996322 IP 10.10.0.2.43429 > 10.30.0.2.3002: . 56017:56541(524) ack 1 win 2920 <nop,nop,timestamp 177044 177038>
07:02:29.996383 IP 10.10.0.2.43429 > 10.30.0.2.3002: . 56541:57065(524) ack 1 win 2920 <nop,nop,timestamp 177044 177038>
07:02:29.996392 IP 10.10.0.2.43429 > 10.30.0.2.3002: . 57065:57589(524) ack 1 win 2920 <nop,nop,timestamp 177044 177038>
07:02:30.033513 IP 10.30.0.2.3002 > 10.10.0.2.43429: . ack 57589 win 3806 <nop,nop,timestamp 177042 177044>
07:02:30.034297 IP 10.10.0.2.43429 > 10.30.0.2.3002: . 57589:58113(524) ack 1 win 2920 <nop,nop,timestamp 177048 177042>
07:02:30.034437 IP 10.10.0.2.43429 > 10.30.0.2.3002: . 58113:58637(524) ack 1 win 2920 <nop,nop,timestamp 177048 177042>
07:02:30.034504 IP 10.10.0.2.43429 > 10.30.0.2.3002: . 58637:59161(524) ack 1 win 2920 <nop,nop,timestamp 177048 177042>
07:02:30.034568 IP 10.10.0.2.43429 > 10.30.0.2.3002: . 59161:59685(524) ack 1 win 2920 <nop,nop,timestamp 177048 177042>
07:02:30.034631 IP 10.10.0.2.43429 > 10.30.0.2.3002: . 59685:60209(524) ack 1 win 2920 <nop,nop,timestamp 177048 177042>
07:02:30.034696 IP 10.10.0.2.43429 > 10.30.0.2.3002: P 60209:60733(524) ack 1 win 2920 <nop,nop,timestamp 177048 177042>
07:02:30.034762 IP 10.10.0.2.43429 > 10.30.0.2.3002: . 60733:61257(524) ack 1 win 2920 <nop,nop,timestamp 177048 177042>
07:02:30.034828 IP 10.10.0.2.43429 > 10.30.0.2.3002: . 61257:61781(524) ack 1 win 2920 <nop,nop,timestamp 177048 177042>
07:02:30.034838 IP 10.10.0.2.43429 > 10.30.0.2.3002: . 61781:62305(524) ack 1 win 2920 <nop,nop,timestamp 177048 177042>
07:02:30.034844 IP 10.10.0.2.43429 > 10.30.0.2.3002: . 62305:62829(524) ack 1 win 2920 <nop,nop,timestamp 177048 177042>
07:02:30.034851 IP 10.10.0.2.43429 > 10.30.0.2.3002: . 62829:63353(524) ack 1 win 2920 <nop,nop,timestamp 177048 177042>
07:02:30.034880 IP 10.30.0.2.3002 > 10.10.0.2.43429: . ack 58113 win 3544 <nop,nop,timestamp 177042 177048>
07:02:30.034909 IP 10.30.0.2.3002 > 10.10.0.2.43429: . ack 58637 win 3282 <nop,nop,timestamp 177042 177048>
07:02:30.034940 IP 10.30.0.2.3002 > 10.10.0.2.43429: . ack 59161 win 3020 <nop,nop,timestamp 177042 177048>
07:02:30.034964 IP 10.30.0.2.3002 > 10.10.0.2.43429: . ack 59685 win 3544 <nop,nop,timestamp 177042 177048>
07:02:30.034988 IP 10.30.0.2.3002 > 10.10.0.2.43429: . ack 60209 win 4068 <nop,nop,timestamp 177042 177048>
07:02:30.035010 IP 10.30.0.2.3002 > 10.10.0.2.43429: . ack 60733 win 4592 <nop,nop,timestamp 177042 177048>
07:02:30.035033 IP 10.30.0.2.3002 > 10.10.0.2.43429: . ack 61257 win 4976 <nop,nop,timestamp 177042 177048>
07:02:30.035914 IP 10.10.0.2.43429 > 10.30.0.2.3002: . 64401:64925(524) ack 1 win 2920 <nop,nop,timestamp 177048 177042>
07:02:30.036009 IP 10.10.0.2.43429 > 10.30.0.2.3002: . 64925:65449(524) ack 1 win 2920 <nop,nop,timestamp 177048 177042>
07:02:30.036085 IP 10.10.0.2.43429 > 10.30.0.2.3002: . 65449:65973(524) ack 1 win 2920 <nop,nop,timestamp 177048 177042>
07:02:30.036161 IP 10.10.0.2.43429 > 10.30.0.2.3002: . 65973:66497(524) ack 1 win 2920 <nop,nop,timestamp 177048 177042>
07:02:30.036237 IP 10.10.0.2.43429 > 10.30.0.2.3002: . 66497:67021(524) ack 1 win 2920 <nop,nop,timestamp 177048 177042>
07:02:30.036338 IP 10.10.0.2.43429 > 10.30.0.2.3002: . 67021:67545(524) ack 1 win 2920 <nop,nop,timestamp 177048 177042>
07:02:30.036348 IP 10.10.0.2.43429 > 10.30.0.2.3002: . 67545:68069(524) ack 1 win 2920 <nop,nop,timestamp 177048 177042>
07:02:30.036354 IP 10.10.0.2.43429 > 10.30.0.2.3002: P 68069:68593(524) ack 1 win 2920 <nop,nop,timestamp 177048 177042>
07:02:30.036366 IP 10.30.0.2.3002 > 10.10.0.2.43429: . ack 63353 win 3928 <nop,nop,timestamp 177042 177048,nop,nop,sack 1 {64401:64925}>
07:02:30.036394 IP 10.30.0.2.3002 > 10.10.0.2.43429: . ack 63353 win 3928 <nop,nop,timestamp 177042 177048,nop,nop,sack 1 {64401:65449}>
07:02:30.036417 IP 10.30.0.2.3002 > 10.10.0.2.43429: . ack 63353 win 3928 <nop,nop,timestamp 177042 177048,nop,nop,sack 1 {64401:65973}>
07:02:30.036454 IP 10.30.0.2.3002 > 10.10.0.2.43429: . ack 63353 win 3928 <nop,nop,timestamp 177042 177048,nop,nop,sack 1 {64401:66497}>
07:02:30.036501 IP 10.30.0.2.3002 > 10.10.0.2.43429: . ack 63353 win 3928 <nop,nop,timestamp 177042 177048,nop,nop,sack 1 {64401:67021}>
07:02:30.036526 IP 10.30.0.2.3002 > 10.10.0.2.43429: . ack 63353 win 3928 <nop,nop,timestamp 177042 177048,nop,nop,sack 1 {64401:67545}>
07:02:30.036549 IP 10.30.0.2.3002 > 10.10.0.2.43429: . ack 63353 win 3928 <nop,nop,timestamp 177042 177048,nop,nop,sack 1 {64401:68069}>
07:02:30.036600 IP 10.30.0.2.3002 > 10.10.0.2.43429: . ack 63353 win 3928 <nop,nop,timestamp 177042 177048,nop,nop,sack 1 {64401:68593}>
07:02:30.037974 IP 10.10.0.2.43429 > 10.30.0.2.3002: . 68593:69117(524) ack 1 win 2920 <nop,nop,timestamp 177048 177042>
07:02:30.038324 IP 10.10.0.2.43429 > 10.30.0.2.3002: . 69117:69641(524) ack 1 win 2920 <nop,nop,timestamp 177048 177042>
07:02:30.038593 IP 10.10.0.2.43429 > 10.30.0.2.3002: . 69641:70165(524) ack 1 win 2920 <nop,nop,timestamp 177048 177042>
07:02:30.038633 IP 10.10.0.2.43429 > 10.30.0.2.3002: . 63353:63877(524) ack 1 win 2920 <nop,nop,timestamp 177048 177042>
07:02:30.038669 IP 10.10.0.2.43429 > 10.30.0.2.3002: . 63877:64401(524) ack 1 win 2920 <nop,nop,timestamp 177048 177042>
07:02:30.038764 IP 10.10.0.2.43429 > 10.30.0.2.3002: . 70165:70689(524) ack 1 win 2920 <nop,nop,timestamp 177048 177042>
07:02:30.038860 IP 10.30.0.2.3002 > 10.10.0.2.43429: . ack 63353 win 3928 <nop,nop,timestamp 177042 177048,nop,nop,sack 1 {64401:69117}>
07:02:30.039006 IP 10.30.0.2.3002 > 10.10.0.2.43429: . ack 63353 win 3928 <nop,nop,timestamp 177042 177048,nop,nop,sack 1 {64401:69641}>
07:02:30.039096 IP 10.30.0.2.3002 > 10.10.0.2.43429: . ack 63353 win 3928 <nop,nop,timestamp 177042 177048,nop,nop,sack 1 {64401:70165}>
07:02:30.039182 IP 10.30.0.2.3002 > 10.10.0.2.43429: . ack 63877 win 3666 <nop,nop,timestamp 177042 177048,nop,nop,sack 1 {64401:70165}>
07:02:30.073637 IP 10.30.0.2.3002 > 10.10.0.2.43429: . ack 70689 win 260 <nop,nop,timestamp 177046 177048>
07:02:30.292140 IP 10.10.0.2.43429 > 10.30.0.2.3002: P 70689:71209(520) ack 1 win 2920 <nop,nop,timestamp 177074 177046>
07:02:30.292921 IP 10.30.0.2.3002 > 10.10.0.2.43429: . ack 71209 win 0 <nop,nop,timestamp 177067 177074>
07:02:30.512186 IP 10.10.0.2.43429 > 10.30.0.2.3002: . ack 1 win 2920 <nop,nop,timestamp 177096 177067>
07:02:30.513136 IP 10.30.0.2.3002 > 10.10.0.2.43429: . ack 71209 win 0 <nop,nop,timestamp 177089 177074>
07:02:30.952119 IP 10.10.0.2.43429 > 10.30.0.2.3002: . ack 1 win 2920 <nop,nop,timestamp 177140 177089>
07:02:30.953160 IP 10.30.0.2.3002 > 10.10.0.2.43429: . ack 71209 win 0 <nop,nop,timestamp 177133 177074>
07:02:31.832160 IP 10.10.0.2.43429 > 10.30.0.2.3002: . ack 1 win 2920 <nop,nop,timestamp 177228 177133>
07:02:31.832935 IP 10.30.0.2.3002 > 10.10.0.2.43429: . ack 71209 win 0 <nop,nop,timestamp 177221 177074>
07:02:31.913941 IP 10.30.0.2.3002 > 10.10.0.2.43429: . ack 71209 win 596 <nop,nop,timestamp 177230 177074>
07:02:31.915948 IP 10.10.0.2.43429 > 10.30.0.2.3002: P 71209:71213(4) ack 1 win 2920 <nop,nop,timestamp 177236 177230>
07:02:31.915995 IP 10.10.0.2.43429 > 10.30.0.2.3002: . 71213:71737(524) ack 1 win 2920 <nop,nop,timestamp 177236 177230>
07:02:31.916002 IP 10.10.0.2.43429 > 10.30.0.2.3002: . 71737:72261(524) ack 1 win 2920 <nop,nop,timestamp 177236 177230>
07:02:31.918378 IP 10.30.0.2.3002 > 10.10.0.2.43429: . ack 71213 win 594 <nop,nop,timestamp 177230 177236>
07:02:31.919359 IP 10.30.0.2.3002 > 10.10.0.2.43429: . ack 71737 win 1972 <nop,nop,timestamp 177230 177236>
07:02:31.919468 IP 10.30.0.2.3002 > 10.10.0.2.43429: . ack 72261 win 2496 <nop,nop,timestamp 177230 177236>
07:02:31.919887 IP 10.30.0.2.3002 > 10.10.0.2.43429: R 1:1(0) ack 72261 win 2496 <nop,nop,timestamp 177230 177236>
07:02:31.922356 IP 10.10.0.2.43429 > 10.30.0.2.3002: . 72261:72785(524) ack 1 win 2920 <nop,nop,timestamp 177236 177230>
07:02:31.922458 IP 10.10.0.2.43429 > 10.30.0.2.3002: . 72785:73309(524) ack 1 win 2920 <nop,nop,timestamp 177236 177230>
07:02:31.922537 IP 10.10.0.2.43429 > 10.30.0.2.3002: . 73309:73833(524) ack 1 win 2920 <nop,nop,timestamp 177236 177230>
07:02:31.922602 IP 10.10.0.2.43429 > 10.30.0.2.3002: . 73833:74357(524) ack 1 win 2920 <nop,nop,timestamp 177236 177230>
07:02:31.922665 IP 10.10.0.2.43429 > 10.30.0.2.3002: . 74357:74881(524) ack 1 win 2920 <nop,nop,timestamp 177236 177230>
07:02:31.922729 IP 10.10.0.2.43429 > 10.30.0.2.3002: . 74881:75405(524) ack 1 win 2920 <nop,nop,timestamp 177236 177230>
07:02:31.922813 IP 10.30.0.2.3002 > 10.10.0.2.43429: R 3719104287:3719104287(0) win 0
07:02:31.922950 IP 10.30.0.2.3002 > 10.10.0.2.43429: R 3719104287:3719104287(0) win 0
07:02:31.923078 IP 10.30.0.2.3002 > 10.10.0.2.43429: R 3719104287:3719104287(0) win 0
07:02:31.923206 IP 10.30.0.2.3002 > 10.10.0.2.43429: R 3719104287:3719104287(0) win 0
07:02:31.923334 IP 10.30.0.2.3002 > 10.10.0.2.43429: R 3719104287:3719104287(0) win 0
07:02:31.923460 IP 10.30.0.2.3002 > 10.10.0.2.43429: R 3719104287:3719104287(0) win 0





07:32:59.368296 IP 127.0.0.1.57322 > 127.0.0.1.3004: S 2345242650:2345242650(0) win 32792 <mss 16396,sackOK,timestamp 359982 0,nop,wscale 1>
07:32:59.368318 IP 127.0.0.1.3004 > 127.0.0.1.57322: R 0:0(0) ack 2345242651 win 0
07:33:09.424593 IP 127.0.0.1.46815 > 127.0.0.1.3002: S 2519792112:2519792112(0) win 32792 <mss 16396,sackOK,timestamp 360989 0,nop,wscale 1>
07:33:09.424620 IP 127.0.0.1.3002 > 127.0.0.1.46815: S 2518249195:2518249195(0) ack 2519792113 win 32768 <mss 16396,sackOK,timestamp 360989 360989,nop,wscale 1>
07:33:09.424638 IP 127.0.0.1.46815 > 127.0.0.1.3002: . ack 1 win 16396 <nop,nop,timestamp 360989 360989>
07:33:09.425476 IP 127.0.0.1.46815 > 127.0.0.1.3002: P 1:8193(8192) ack 1 win 16396 <nop,nop,timestamp 360989 360989>
07:33:09.425489 IP 127.0.0.1.3002 > 127.0.0.1.46815: . ack 8193 win 24576 <nop,nop,timestamp 360989 360989>
07:33:09.425557 IP 127.0.0.1.46815 > 127.0.0.1.3002: P 8193:16385(8192) ack 1 win 16396 <nop,nop,timestamp 360989 360989>
07:33:09.425566 IP 127.0.0.1.3002 > 127.0.0.1.46815: . ack 16385 win 24576 <nop,nop,timestamp 360989 360989>
07:33:09.425631 IP 127.0.0.1.46815 > 127.0.0.1.3002: P 16385:24577(8192) ack 1 win 16396 <nop,nop,timestamp 360989 360989>
07:33:09.425639 IP 127.0.0.1.3002 > 127.0.0.1.46815: . ack 24577 win 23120 <nop,nop,timestamp 360989 360989>
07:33:09.425703 IP 127.0.0.1.46815 > 127.0.0.1.3002: P 24577:32769(8192) ack 1 win 16396 <nop,nop,timestamp 360989 360989>
07:33:09.425829 IP 127.0.0.1.46815 > 127.0.0.1.3002: P 32769:49153(16384) ack 1 win 16396 <nop,nop,timestamp 360989 360989>
07:33:09.425946 IP 127.0.0.1.46815 > 127.0.0.1.3002: P 49153:65537(16384) ack 1 win 16396 <nop,nop,timestamp 360989 360989>
07:33:09.429862 IP 127.0.0.1.3002 > 127.0.0.1.46815: . ack 65537 win 2640 <nop,nop,timestamp 360994 360989>
07:33:09.648200 IP 127.0.0.1.46815 > 127.0.0.1.3002: P 65537:70817(5280) ack 1 win 16396 <nop,nop,timestamp 361015 360994>
07:33:09.648248 IP 127.0.0.1.3002 > 127.0.0.1.46815: . ack 70817 win 0 <nop,nop,timestamp 361015 361015>
07:33:09.857630 IP 127.0.0.1.46815 > 127.0.0.1.3002: . ack 1 win 16396 <nop,nop,timestamp 361036 361015>
07:33:09.857655 IP 127.0.0.1.3002 > 127.0.0.1.46815: . ack 70817 win 0 <nop,nop,timestamp 361036 361015>
07:33:10.277675 IP 127.0.0.1.46815 > 127.0.0.1.3002: . ack 1 win 16396 <nop,nop,timestamp 361078 361036>
07:33:10.277715 IP 127.0.0.1.3002 > 127.0.0.1.46815: . ack 70817 win 0 <nop,nop,timestamp 361078 361015>
07:33:11.117668 IP 127.0.0.1.46815 > 127.0.0.1.3002: . ack 1 win 16396 <nop,nop,timestamp 361162 361078>
07:33:11.117706 IP 127.0.0.1.3002 > 127.0.0.1.46815: . ack 70817 win 0 <nop,nop,timestamp 361162 361015>
07:33:11.428307 IP 127.0.0.1.3002 > 127.0.0.1.46815: . ack 70817 win 8420 <nop,nop,timestamp 361193 361015>
07:33:11.428350 IP 127.0.0.1.46815 > 127.0.0.1.3002: P 70817:81921(11104) ack 1 win 16396 <nop,nop,timestamp 361193 361193>
07:33:11.428425 IP 127.0.0.1.3002 > 127.0.0.1.46815: . ack 81921 win 2868 <nop,nop,timestamp 361193 361193>
07:33:11.430155 IP 127.0.0.1.3002 > 127.0.0.1.46815: R 1:1(0) ack 81921 win 24576 <nop,nop,timestamp 361193 361193>


8.10


07:41:34.536442 IP 10.10.0.2.39127 > 10.40.0.2.9: S 1821096979:1821096979(0) win 5840 <mss 1460,sackOK,timestamp 411476 0,nop,wscale 1>
07:41:34.643170 IP 10.40.0.2.9 > 10.10.0.2.39127: S 1818863512:1818863512(0) ack 1821096980 win 5792 <mss 1460,sackOK,timestamp 411474 411476,nop,wscale 1>
07:41:34.643451 IP 10.10.0.2.39127 > 10.40.0.2.9: . ack 1 win 2920 <nop,nop,timestamp 411489 411474>
07:41:34.643531 IP 10.10.0.2.39127 > 10.40.0.2.9: P 1:101(100) ack 1 win 2920 <nop,nop,timestamp 411489 411474>
07:41:34.653944 IP 10.10.0.2.39127 > 10.40.0.2.9: P 101:201(100) ack 1 win 2920 <nop,nop,timestamp 411490 411474>
07:41:34.753257 IP 10.40.0.2.9 > 10.10.0.2.39127: . ack 101 win 2896 <nop,nop,timestamp 411485 411489>
07:41:34.753673 IP 10.10.0.2.39127 > 10.40.0.2.9: P 201:1201(1000) ack 1 win 2920 <nop,nop,timestamp 411500 411485>
07:41:34.763847 IP 10.10.0.2.39127 > 10.40.0.2.9: P 1201:1301(100) ack 1 win 2920 <nop,nop,timestamp 411501 411485>
07:41:34.764276 IP 10.40.0.2.9 > 10.10.0.2.39127: . ack 201 win 2896 <nop,nop,timestamp 411485 411490>
07:41:34.769316 IP 10.10.0.2.39127 > 10.40.0.2.9: P 1301:1401(100) ack 1 win 2920 <nop,nop,timestamp 411502 411485>
07:41:34.778632 IP 10.10.0.2.39127 > 10.40.0.2.9: P 1401:1501(100) ack 1 win 2920 <nop,nop,timestamp 411503 411485>
07:41:34.839476 IP 10.10.0.2.39127 > 10.40.0.2.9: FP 1501:2001(500) ack 1 win 2920 <nop,nop,timestamp 411509 411485>
07:41:34.863241 IP 10.40.0.2.9 > 10.10.0.2.39127: . ack 1201 win 3896 <nop,nop,timestamp 411496 411500>
07:41:34.873183 IP 10.40.0.2.9 > 10.10.0.2.39127: . ack 1301 win 3896 <nop,nop,timestamp 411497 411501>
07:41:34.873661 IP 10.40.0.2.9 > 10.10.0.2.39127: . ack 1401 win 3896 <nop,nop,timestamp 411497 411502>
07:41:34.884122 IP 10.40.0.2.9 > 10.10.0.2.39127: . ack 1501 win 3896 <nop,nop,timestamp 411498 411503>
07:41:34.953154 IP 10.40.0.2.9 > 10.10.0.2.39127: F 1:1(0) ack 2002 win 4896 <nop,nop,timestamp 411504 411509>
07:41:34.953485 IP 10.10.0.2.39127 > 10.40.0.2.9: . ack 2 win 2920 <nop,nop,timestamp 411520 411504>



07:42:20.771584 IP 10.10.0.2.39128 > 10.40.0.2.9: S 2541681046:2541681046(0) win 5840 <mss 1460,sackOK,timestamp 416098 0,nop,wscale 1>
07:42:20.873221 IP 10.40.0.2.9 > 10.10.0.2.39128: S 2549216088:2549216088(0) ack 2541681047 win 5792 <mss 1460,sackOK,timestamp 416097 416098,nop,wscale 1>
07:42:20.873557 IP 10.10.0.2.39128 > 10.40.0.2.9: . ack 1 win 2920 <nop,nop,timestamp 416112 416097>
07:42:20.873695 IP 10.10.0.2.39128 > 10.40.0.2.9: P 1:101(100) ack 1 win 2920 <nop,nop,timestamp 416112 416097>
07:42:20.883948 IP 10.10.0.2.39128 > 10.40.0.2.9: P 101:201(100) ack 1 win 2920 <nop,nop,timestamp 416113 416097>
07:42:20.888173 IP 10.10.0.2.39128 > 10.40.0.2.9: P 201:301(100) ack 1 win 2920 <nop,nop,timestamp 416114 416097>
07:42:20.983269 IP 10.40.0.2.9 > 10.10.0.2.39128: . ack 101 win 2896 <nop,nop,timestamp 416108 416112>
07:42:20.983762 IP 10.10.0.2.39128 > 10.40.0.2.9: P 301:1201(900) ack 1 win 2920 <nop,nop,timestamp 416123 416108>
07:42:20.993817 IP 10.10.0.2.39128 > 10.40.0.2.9: P 1201:1301(100) ack 1 win 2920 <nop,nop,timestamp 416124 416108>
07:42:21.002848 IP 10.40.0.2.9 > 10.10.0.2.39128: . ack 201 win 2896 <nop,nop,timestamp 416108 416113>
07:42:21.002885 IP 10.40.0.2.9 > 10.10.0.2.39128: . ack 301 win 2896 <nop,nop,timestamp 416108 416114>
07:42:21.003228 IP 10.10.0.2.39128 > 10.40.0.2.9: P 1301:1401(100) ack 1 win 2920 <nop,nop,timestamp 416125 416108>
07:42:21.013322 IP 10.10.0.2.39128 > 10.40.0.2.9: P 1401:1501(100) ack 1 win 2920 <nop,nop,timestamp 416126 416108>
07:42:21.018514 IP 10.10.0.2.39128 > 10.40.0.2.9: P 1501:1601(100) ack 1 win 2920 <nop,nop,timestamp 416127 416108>
07:42:21.028569 IP 10.10.0.2.39128 > 10.40.0.2.9: P 1601:1701(100) ack 1 win 2920 <nop,nop,timestamp 416128 416108>
07:42:21.093185 IP 10.40.0.2.9 > 10.10.0.2.39128: . ack 1201 win 3796 <nop,nop,timestamp 416119 416123>
07:42:21.093574 IP 10.10.0.2.39128 > 10.40.0.2.9: P 1701:2301(600) ack 1 win 2920 <nop,nop,timestamp 416134 416119>
07:42:21.103769 IP 10.10.0.2.39128 > 10.40.0.2.9: P 2301:2401(100) ack 1 win 2920 <nop,nop,timestamp 416135 416119>
07:42:21.112484 IP 10.40.0.2.9 > 10.10.0.2.39128: . ack 1301 win 3796 <nop,nop,timestamp 416119 416124>
07:42:21.112529 IP 10.40.0.2.9 > 10.10.0.2.39128: . ack 1401 win 3796 <nop,nop,timestamp 416121 416125>
07:42:21.113034 IP 10.10.0.2.39128 > 10.40.0.2.9: P 2401:2501(100) ack 1 win 2920 <nop,nop,timestamp 416136 416119>
07:42:21.122916 IP 10.10.0.2.39128 > 10.40.0.2.9: P 2501:2601(100) ack 1 win 2920 <nop,nop,timestamp 416137 416121>
07:42:21.123527 IP 10.40.0.2.9 > 10.10.0.2.39128: . ack 1501 win 3796 <nop,nop,timestamp 416122 416126>
07:42:21.124187 IP 10.40.0.2.9 > 10.10.0.2.39128: . ack 1601 win 3796 <nop,nop,timestamp 416122 416127>
07:42:21.128206 IP 10.10.0.2.39128 > 10.40.0.2.9: P 2601:2701(100) ack 1 win 2920 <nop,nop,timestamp 416138 416122>
07:42:21.136509 IP 10.40.0.2.9 > 10.10.0.2.39128: . ack 1701 win 3796 <nop,nop,timestamp 416123 416128>
07:42:21.145102 IP 10.10.0.2.39128 > 10.40.0.2.9: P 2701:2801(100) ack 1 win 2920 <nop,nop,timestamp 416139 416123>
07:42:21.148627 IP 10.10.0.2.39128 > 10.40.0.2.9: P 2801:2901(100) ack 1 win 2920 <nop,nop,timestamp 416140 416123>
07:42:21.158516 IP 10.10.0.2.39128 > 10.40.0.2.9: P 2901:3001(100) ack 1 win 2920 <nop,nop,timestamp 416141 416123>
07:42:21.168419 IP 10.10.0.2.39128 > 10.40.0.2.9: P 3001:3101(100) ack 1 win 2920 <nop,nop,timestamp 416142 416123>
07:42:21.203181 IP 10.40.0.2.9 > 10.10.0.2.39128: . ack 2301 win 4696 <nop,nop,timestamp 416130 416134>
07:42:21.203556 IP 10.10.0.2.39128 > 10.40.0.2.9: P 3101:3201(100) ack 1 win 2920 <nop,nop,timestamp 416145 416130>
07:42:21.214277 IP 10.40.0.2.9 > 10.10.0.2.39128: . ack 2401 win 4696 <nop,nop,timestamp 416130 416135>
07:42:21.214397 IP 10.40.0.2.9 > 10.10.0.2.39128: . ack 2501 win 4696 <nop,nop,timestamp 416132 416136>
07:42:21.214506 IP 10.10.0.2.39128 > 10.40.0.2.9: P 3201:3301(100) ack 1 win 2920 <nop,nop,timestamp 416146 416130>
07:42:21.219237 IP 10.10.0.2.39128 > 10.40.0.2.9: P 3301:3401(100) ack 1 win 2920 <nop,nop,timestamp 416147 416132>
07:42:21.226796 IP 10.40.0.2.9 > 10.10.0.2.39128: . ack 2601 win 4696 <nop,nop,timestamp 416133 416137>
07:42:21.233152 IP 10.40.0.2.9 > 10.10.0.2.39128: . ack 2701 win 4696 <nop,nop,timestamp 416133 416138>
07:42:21.240675 IP 10.10.0.2.39128 > 10.40.0.2.9: P 3401:3501(100) ack 1 win 2920 <nop,nop,timestamp 416149 416133>
07:42:21.248583 IP 10.10.0.2.39128 > 10.40.0.2.9: P 3501:3601(100) ack 1 win 2920 <nop,nop,timestamp 416150 416133>
07:42:21.253171 IP 10.40.0.2.9 > 10.10.0.2.39128: . ack 2801 win 4696 <nop,nop,timestamp 416135 416139>
07:42:21.253213 IP 10.40.0.2.9 > 10.10.0.2.39128: . ack 2901 win 4696 <nop,nop,timestamp 416135 416140>
07:42:21.263227 IP 10.40.0.2.9 > 10.10.0.2.39128: . ack 3001 win 4696 <nop,nop,timestamp 416136 416141>
07:42:21.263506 IP 10.10.0.2.39128 > 10.40.0.2.9: P 3601:3701(100) ack 1 win 2920 <nop,nop,timestamp 416151 416135>
07:42:21.268820 IP 10.10.0.2.39128 > 10.40.0.2.9: P 3701:3801(100) ack 1 win 2920 <nop,nop,timestamp 416152 416136>
07:42:21.278510 IP 10.10.0.2.39128 > 10.40.0.2.9: P 3801:3901(100) ack 1 win 2920 <nop,nop,timestamp 416153 416136>
07:42:21.287095 IP 10.40.0.2.9 > 10.10.0.2.39128: . ack 3101 win 4696 <nop,nop,timestamp 416137 416142>
07:42:21.295566 IP 10.10.0.2.39128 > 10.40.0.2.9: P 3901:4001(100) ack 1 win 2920 <nop,nop,timestamp 416154 416137>
07:42:21.298616 IP 10.10.0.2.39128 > 10.40.0.2.9: P 4001:4101(100) ack 1 win 2920 <nop,nop,timestamp 416155 416137>
07:42:21.308647 IP 10.10.0.2.39128 > 10.40.0.2.9: P 4101:4201(100) ack 1 win 2920 <nop,nop,timestamp 416156 416137>
07:42:21.313438 IP 10.40.0.2.9 > 10.10.0.2.39128: . ack 3201 win 4696 <nop,nop,timestamp 416141 416145>
07:42:21.323519 IP 10.40.0.2.9 > 10.10.0.2.39128: . ack 3301 win 4696 <nop,nop,timestamp 416142 416146>
07:42:21.323566 IP 10.40.0.2.9 > 10.10.0.2.39128: . ack 3401 win 4696 <nop,nop,timestamp 416142 416147>
07:42:21.324255 IP 10.10.0.2.39128 > 10.40.0.2.9: P 4201:4301(100) ack 1 win 2920 <nop,nop,timestamp 416157 416142>
07:42:21.328451 IP 10.10.0.2.39128 > 10.40.0.2.9: P 4301:4401(100) ack 1 win 2920 <nop,nop,timestamp 416158 416142>
07:42:21.338553 IP 10.10.0.2.39128 > 10.40.0.2.9: P 4401:4501(100) ack 1 win 2920 <nop,nop,timestamp 416159 416142>
07:42:21.343683 IP 10.40.0.2.9 > 10.10.0.2.39128: . ack 3501 win 4696 <nop,nop,timestamp 416144 416149>
07:42:21.351975 IP 10.10.0.2.39128 > 10.40.0.2.9: P 4501:4601(100) ack 1 win 2920 <nop,nop,timestamp 416160 416144>
07:42:21.354518 IP 10.40.0.2.9 > 10.10.0.2.39128: . ack 3601 win 4696 <nop,nop,timestamp 416144 416150>
07:42:21.361334 IP 10.10.0.2.39128 > 10.40.0.2.9: P 4601:4701(100) ack 1 win 2920 <nop,nop,timestamp 416161 416144>
07:42:21.368590 IP 10.10.0.2.39128 > 10.40.0.2.9: P 4701:4801(100) ack 1 win 2920 <nop,nop,timestamp 416162 416144>
07:42:21.376571 IP 10.40.0.2.9 > 10.10.0.2.39128: . ack 3701 win 4696 <nop,nop,timestamp 416147 416151>
07:42:21.376622 IP 10.40.0.2.9 > 10.10.0.2.39128: . ack 3801 win 4696 <nop,nop,timestamp 416147 416152>
07:42:21.383121 IP 10.40.0.2.9 > 10.10.0.2.39128: . ack 3901 win 4696 <nop,nop,timestamp 416147 416153>
07:42:21.391301 IP 10.10.0.2.39128 > 10.40.0.2.9: P 4801:4901(100) ack 1 win 2920 <nop,nop,timestamp 416164 416147>
07:42:21.398597 IP 10.10.0.2.39128 > 10.40.0.2.9: P 4901:5001(100) ack 1 win 2920 <nop,nop,timestamp 416165 416147>
07:42:21.406436 IP 10.40.0.2.9 > 10.10.0.2.39128: . ack 4001 win 4696 <nop,nop,timestamp 416150 416154>
07:42:21.406477 IP 10.40.0.2.9 > 10.10.0.2.39128: . ack 4101 win 4696 <nop,nop,timestamp 416150 416155>
07:42:21.413148 IP 10.40.0.2.9 > 10.10.0.2.39128: . ack 4201 win 4696 <nop,nop,timestamp 416150 416156>
07:42:21.423400 IP 10.10.0.2.39128 > 10.40.0.2.9: F 5001:5001(0) ack 1 win 2920 <nop,nop,timestamp 416167 416150>
07:42:21.438081 IP 10.40.0.2.9 > 10.10.0.2.39128: . ack 4301 win 4696 <nop,nop,timestamp 416153 416157>
07:42:21.438121 IP 10.40.0.2.9 > 10.10.0.2.39128: . ack 4401 win 4696 <nop,nop,timestamp 416153 416158>
07:42:21.443158 IP 10.40.0.2.9 > 10.10.0.2.39128: . ack 4501 win 4696 <nop,nop,timestamp 416154 416159>
07:42:21.453232 IP 10.40.0.2.9 > 10.10.0.2.39128: . ack 4601 win 4696 <nop,nop,timestamp 416155 416160>
07:42:21.463478 IP 10.40.0.2.9 > 10.10.0.2.39128: . ack 4701 win 4696 <nop,nop,timestamp 416156 416161>
07:42:21.473402 IP 10.40.0.2.9 > 10.10.0.2.39128: . ack 4801 win 4696 <nop,nop,timestamp 416157 416162>
07:42:21.493337 IP 10.40.0.2.9 > 10.10.0.2.39128: . ack 4901 win 4696 <nop,nop,timestamp 416159 416164>
07:42:21.503334 IP 10.40.0.2.9 > 10.10.0.2.39128: . ack 5001 win 4696 <nop,nop,timestamp 416160 416165>
07:42:21.533246 IP 10.40.0.2.9 > 10.10.0.2.39128: F 1:1(0) ack 5002 win 4696 <nop,nop,timestamp 416163 416167>
07:42:21.533634 IP 10.10.0.2.39128 > 10.40.0.2.9: . ack 2 win 2920 <nop,nop,timestamp 416178 416163>



07:42:53.915229 IP 10.10.0.2.39129 > 10.40.0.2.9: S 3068540048:3068540048(0) win 5840 <mss 1460,sackOK,timestamp 419413 0,nop,wscale 1>
07:42:54.023218 IP 10.40.0.2.9 > 10.10.0.2.39129: S 3058293115:3058293115(0) ack 3068540049 win 5792 <mss 1460,sackOK,timestamp 419412 419413,nop,wscale 1>
07:42:54.023871 IP 10.10.0.2.39129 > 10.40.0.2.9: . ack 1 win 2920 <nop,nop,timestamp 419427 419412>
07:42:54.024065 IP 10.10.0.2.39129 > 10.40.0.2.9: P 1:101(100) ack 1 win 2920 <nop,nop,timestamp 419427 419412>
07:42:54.034425 IP 10.10.0.2.39129 > 10.40.0.2.9: P 101:201(100) ack 1 win 2920 <nop,nop,timestamp 419428 419412>
07:42:54.040121 IP 10.10.0.2.39129 > 10.40.0.2.9: P 201:301(100) ack 1 win 2920 <nop,nop,timestamp 419429 419412>
07:42:54.133211 IP 10.40.0.2.9 > 10.10.0.2.39129: . ack 101 win 2896 <nop,nop,timestamp 419423 419427>
07:42:54.133587 IP 10.10.0.2.39129 > 10.40.0.2.9: P 301:1201(900) ack 1 win 2920 <nop,nop,timestamp 419438 419423>
07:42:54.143765 IP 10.10.0.2.39129 > 10.40.0.2.9: P 1201:1301(100) ack 1 win 2920 <nop,nop,timestamp 419439 419423>
07:42:54.152491 IP 10.40.0.2.9 > 10.10.0.2.39129: . ack 201 win 2896 <nop,nop,timestamp 419423 419428>
07:42:54.152538 IP 10.40.0.2.9 > 10.10.0.2.39129: . ack 301 win 2896 <nop,nop,timestamp 419423 419429>
07:42:54.153214 IP 10.10.0.2.39129 > 10.40.0.2.9: P 1301:1401(100) ack 1 win 2920 <nop,nop,timestamp 419440 419423>
07:42:54.162899 IP 10.10.0.2.39129 > 10.40.0.2.9: P 1401:1501(100) ack 1 win 2920 <nop,nop,timestamp 419441 419423>
07:42:54.168486 IP 10.10.0.2.39129 > 10.40.0.2.9: P 1501:1601(100) ack 1 win 2920 <nop,nop,timestamp 419442 419423>
07:42:54.178522 IP 10.10.0.2.39129 > 10.40.0.2.9: P 1601:1701(100) ack 1 win 2920 <nop,nop,timestamp 419443 419423>
07:42:54.243113 IP 10.40.0.2.9 > 10.10.0.2.39129: . ack 1201 win 3796 <nop,nop,timestamp 419434 419438>
07:42:54.243516 IP 10.10.0.2.39129 > 10.40.0.2.9: P 1701:2301(600) ack 1 win 2920 <nop,nop,timestamp 419449 419434>
07:42:54.253672 IP 10.10.0.2.39129 > 10.40.0.2.9: P 2301:2401(100) ack 1 win 2920 <nop,nop,timestamp 419450 419434>
07:42:54.254104 IP 10.40.0.2.9 > 10.10.0.2.39129: . ack 1301 win 3796 <nop,nop,timestamp 419434 419439>
07:42:54.254143 IP 10.40.0.2.9 > 10.10.0.2.39129: . ack 1401 win 3796 <nop,nop,timestamp 419436 419440>
07:42:54.259333 IP 10.10.0.2.39129 > 10.40.0.2.9: P 2401:2501(100) ack 1 win 2920 <nop,nop,timestamp 419451 419436>
07:42:54.266934 IP 10.40.0.2.9 > 10.10.0.2.39129: . ack 1501 win 3796 <nop,nop,timestamp 419436 419441>
07:42:54.273118 IP 10.40.0.2.9 > 10.10.0.2.39129: . ack 1601 win 3796 <nop,nop,timestamp 419436 419442>
07:42:54.280615 IP 10.10.0.2.39129 > 10.40.0.2.9: P 2501:2601(100) ack 1 win 2920 <nop,nop,timestamp 419453 419436>
07:42:54.285276 IP 10.40.0.2.9 > 10.10.0.2.39129: . ack 1701 win 3796 <nop,nop,timestamp 419438 419443>
07:42:54.291474 IP 10.10.0.2.39129 > 10.40.0.2.9: P 2601:2701(100) ack 1 win 2920 <nop,nop,timestamp 419454 419438>
07:42:54.298532 IP 10.10.0.2.39129 > 10.40.0.2.9: P 2701:2801(100) ack 1 win 2920 <nop,nop,timestamp 419455 419438>
07:42:54.308449 IP 10.10.0.2.39129 > 10.40.0.2.9: P 2801:2901(100) ack 1 win 2920 <nop,nop,timestamp 419456 419438>
07:42:54.318873 IP 10.10.0.2.39129 > 10.40.0.2.9: P 2901:3001(100) ack 1 win 2920 <nop,nop,timestamp 419457 419438>
07:42:54.328563 IP 10.10.0.2.39129 > 10.40.0.2.9: P 3001:3101(100) ack 1 win 2920 <nop,nop,timestamp 419458 419438>
07:42:54.353162 IP 10.40.0.2.9 > 10.10.0.2.39129: . ack 2301 win 4696 <nop,nop,timestamp 419445 419449>
07:42:54.353677 IP 10.10.0.2.39129 > 10.40.0.2.9: P 3101:3201(100) ack 1 win 2920 <nop,nop,timestamp 419460 419445>
07:42:54.363923 IP 10.10.0.2.39129 > 10.40.0.2.9: P 3201:3301(100) ack 1 win 2920 <nop,nop,timestamp 419461 419445>
07:42:54.364279 IP 10.40.0.2.9 > 10.10.0.2.39129: . ack 2401 win 4696 <nop,nop,timestamp 419446 419450>
07:42:54.364353 IP 10.40.0.2.9 > 10.10.0.2.39129: . ack 2501 win 4696 <nop,nop,timestamp 419446 419451>
07:42:54.369382 IP 10.10.0.2.39129 > 10.40.0.2.9: P 3301:3401(100) ack 1 win 2920 <nop,nop,timestamp 419462 419446>
07:42:54.378567 IP 10.10.0.2.39129 > 10.40.0.2.9: P 3401:3501(100) ack 1 win 2920 <nop,nop,timestamp 419463 419446>
07:42:54.385334 IP 10.40.0.2.9 > 10.10.0.2.39129: . ack 2601 win 4696 <nop,nop,timestamp 419448 419453>
07:42:54.393128 IP 10.40.0.2.9 > 10.10.0.2.39129: . ack 2701 win 4696 <nop,nop,timestamp 419449 419454>
07:42:54.393558 IP 10.10.0.2.39129 > 10.40.0.2.9: P 3501:3601(100) ack 1 win 2920 <nop,nop,timestamp 419464 419448>
07:42:54.398575 IP 10.10.0.2.39129 > 10.40.0.2.9: P 3601:3701(100) ack 1 win 2920 <nop,nop,timestamp 419465 419449>
07:42:54.408727 IP 10.10.0.2.39129 > 10.40.0.2.9: P 3701:3801(100) ack 1 win 2920 <nop,nop,timestamp 419466 419449>
07:42:54.417421 IP 10.40.0.2.9 > 10.10.0.2.39129: . ack 2801 win 4696 <nop,nop,timestamp 419450 419455>
07:42:54.417458 IP 10.40.0.2.9 > 10.10.0.2.39129: . ack 2901 win 4696 <nop,nop,timestamp 419451 419456>
07:42:54.423080 IP 10.40.0.2.9 > 10.10.0.2.39129: . ack 3001 win 4696 <nop,nop,timestamp 419452 419457>
07:42:54.431313 IP 10.10.0.2.39129 > 10.40.0.2.9: P 3801:3901(100) ack 1 win 2920 <nop,nop,timestamp 419468 419452>
07:42:54.433812 IP 10.40.0.2.9 > 10.10.0.2.39129: . ack 3101 win 4696 <nop,nop,timestamp 419453 419458>
07:42:54.439276 IP 10.10.0.2.39129 > 10.40.0.2.9: P 3901:4001(100) ack 1 win 2920 <nop,nop,timestamp 419469 419453>
07:42:54.448517 IP 10.10.0.2.39129 > 10.40.0.2.9: P 4001:4101(100) ack 1 win 2920 <nop,nop,timestamp 419470 419453>
07:42:54.455320 IP 10.40.0.2.9 > 10.10.0.2.39129: . ack 3201 win 4696 <nop,nop,timestamp 419456 419460>
07:42:54.463389 IP 10.10.0.2.39129 > 10.40.0.2.9: P 4101:4201(100) ack 1 win 2920 <nop,nop,timestamp 419471 419456>
07:42:54.468452 IP 10.10.0.2.39129 > 10.40.0.2.9: P 4201:4301(100) ack 1 win 2920 <nop,nop,timestamp 419472 419456>
07:42:54.478573 IP 10.10.0.2.39129 > 10.40.0.2.9: P 4301:4401(100) ack 1 win 2920 <nop,nop,timestamp 419473 419456>
07:42:54.480343 IP 10.40.0.2.9 > 10.10.0.2.39129: . ack 3301 win 4696 <nop,nop,timestamp 419457 419461>
07:42:54.480380 IP 10.40.0.2.9 > 10.10.0.2.39129: . ack 3401 win 4696 <nop,nop,timestamp 419457 419462>
07:42:54.480403 IP 10.40.0.2.9 > 10.10.0.2.39129: . ack 3501 win 4696 <nop,nop,timestamp 419458 419463>
07:42:54.491367 IP 10.10.0.2.39129 > 10.40.0.2.9: P 4401:4501(100) ack 1 win 2920 <nop,nop,timestamp 419474 419458>
07:42:54.498500 IP 10.10.0.2.39129 > 10.40.0.2.9: P 4501:4601(100) ack 1 win 2920 <nop,nop,timestamp 419475 419458>
07:42:54.506144 IP 10.40.0.2.9 > 10.10.0.2.39129: . ack 3601 win 4696 <nop,nop,timestamp 419460 419464>
07:42:54.506185 IP 10.40.0.2.9 > 10.10.0.2.39129: . ack 3701 win 4696 <nop,nop,timestamp 419460 419465>
07:42:54.513129 IP 10.40.0.2.9 > 10.10.0.2.39129: . ack 3801 win 4696 <nop,nop,timestamp 419460 419466>
07:42:54.521606 IP 10.10.0.2.39129 > 10.40.0.2.9: P 4601:4701(100) ack 1 win 2920 <nop,nop,timestamp 419477 419460>
07:42:54.528492 IP 10.10.0.2.39129 > 10.40.0.2.9: P 4701:4801(100) ack 1 win 2920 <nop,nop,timestamp 419478 419460>
07:42:54.536028 IP 10.40.0.2.9 > 10.10.0.2.39129: . ack 3901 win 4696 <nop,nop,timestamp 419463 419468>
07:42:54.543133 IP 10.40.0.2.9 > 10.10.0.2.39129: . ack 4001 win 4696 <nop,nop,timestamp 419464 419469>
07:42:54.551358 IP 10.10.0.2.39129 > 10.40.0.2.9: P 4801:4901(100) ack 1 win 2920 <nop,nop,timestamp 419480 419464>
07:42:54.553510 IP 10.40.0.2.9 > 10.10.0.2.39129: . ack 4101 win 4696 <nop,nop,timestamp 419465 419470>
07:42:54.558935 IP 10.10.0.2.39129 > 10.40.0.2.9: P 4901:5001(100) ack 1 win 2920 <nop,nop,timestamp 419481 419465>
07:42:54.566898 IP 10.40.0.2.9 > 10.10.0.2.39129: . ack 4201 win 4696 <nop,nop,timestamp 419467 419471>
07:42:54.572956 IP 10.40.0.2.9 > 10.10.0.2.39129: . ack 4301 win 4696 <nop,nop,timestamp 419467 419472>
07:42:54.580591 IP 10.10.0.2.39129 > 10.40.0.2.9: P 5001:5101(100) ack 1 win 2920 <nop,nop,timestamp 419483 419467>
07:42:54.588339 IP 10.10.0.2.39129 > 10.40.0.2.9: P 5101:5201(100) ack 1 win 2920 <nop,nop,timestamp 419484 419467>
07:42:54.596821 IP 10.40.0.2.9 > 10.10.0.2.39129: . ack 4401 win 4696 <nop,nop,timestamp 419468 419473>
07:42:54.596835 IP 10.40.0.2.9 > 10.10.0.2.39129: . ack 4501 win 4696 <nop,nop,timestamp 419469 419474>
07:42:54.603096 IP 10.40.0.2.9 > 10.10.0.2.39129: . ack 4601 win 4696 <nop,nop,timestamp 419470 419475>
07:42:54.611340 IP 10.10.0.2.39129 > 10.40.0.2.9: P 5201:5301(100) ack 1 win 2920 <nop,nop,timestamp 419486 419470>
07:42:54.619003 IP 10.10.0.2.39129 > 10.40.0.2.9: P 5301:5401(100) ack 1 win 2920 <nop,nop,timestamp 419487 419470>
07:42:54.626677 IP 10.40.0.2.9 > 10.10.0.2.39129: . ack 4701 win 4696 <nop,nop,timestamp 419472 419477>
07:42:54.633107 IP 10.40.0.2.9 > 10.10.0.2.39129: . ack 4801 win 4696 <nop,nop,timestamp 419473 419478>
07:42:54.642798 IP 10.10.0.2.39129 > 10.40.0.2.9: P 5401:5501(100) ack 1 win 2920 <nop,nop,timestamp 419489 419473>
07:42:54.648399 IP 10.10.0.2.39129 > 10.40.0.2.9: P 5501:5601(100) ack 1 win 2920 <nop,nop,timestamp 419490 419473>
07:42:54.657350 IP 10.40.0.2.9 > 10.10.0.2.39129: . ack 4901 win 4696 <nop,nop,timestamp 419475 419480>
07:42:54.663733 IP 10.40.0.2.9 > 10.10.0.2.39129: . ack 5001 win 4696 <nop,nop,timestamp 419476 419481>
07:42:54.672383 IP 10.10.0.2.39129 > 10.40.0.2.9: P 5601:5701(100) ack 1 win 2920 <nop,nop,timestamp 419492 419476>
07:42:54.678480 IP 10.10.0.2.39129 > 10.40.0.2.9: P 5701:5801(100) ack 1 win 2920 <nop,nop,timestamp 419493 419476>
07:42:54.685207 IP 10.40.0.2.9 > 10.10.0.2.39129: . ack 5101 win 4696 <nop,nop,timestamp 419478 419483>
07:42:54.693069 IP 10.40.0.2.9 > 10.10.0.2.39129: . ack 5201 win 4696 <nop,nop,timestamp 419478 419484>
07:42:54.693667 IP 10.10.0.2.39129 > 10.40.0.2.9: P 5801:5901(100) ack 1 win 2920 <nop,nop,timestamp 419494 419478>
07:42:54.699162 IP 10.10.0.2.39129 > 10.40.0.2.9: P 5901:6001(100) ack 1 win 2920 <nop,nop,timestamp 419495 419478>
07:42:54.708581 IP 10.10.0.2.39129 > 10.40.0.2.9: P 6001:6101(100) ack 1 win 2920 <nop,nop,timestamp 419496 419478>
07:42:54.718037 IP 10.40.0.2.9 > 10.10.0.2.39129: . ack 5301 win 4696 <nop,nop,timestamp 419481 419486>
07:42:54.719981 IP 10.10.0.2.39129 > 10.40.0.2.9: P 6101:6201(100) ack 1 win 2920 <nop,nop,timestamp 419497 419481>
07:42:54.727299 IP 10.40.0.2.9 > 10.10.0.2.39129: . ack 5401 win 4696 <nop,nop,timestamp 419482 419487>
07:42:54.737080 IP 10.10.0.2.39129 > 10.40.0.2.9: P 6201:6301(100) ack 1 win 2920 <nop,nop,timestamp 419498 419482>
07:42:54.745866 IP 10.40.0.2.9 > 10.10.0.2.39129: . ack 5501 win 4696 <nop,nop,timestamp 419485 419489>
07:42:54.748401 IP 10.10.0.2.39129 > 10.40.0.2.9: P 6301:6401(100) ack 1 win 2920 <nop,nop,timestamp 419500 419485>
07:42:54.753159 IP 10.40.0.2.9 > 10.10.0.2.39129: . ack 5601 win 4696 <nop,nop,timestamp 419485 419490>
07:42:54.763506 IP 10.10.0.2.39129 > 10.40.0.2.9: P 6401:6501(100) ack 1 win 2920 <nop,nop,timestamp 419501 419485>
07:42:54.768575 IP 10.10.0.2.39129 > 10.40.0.2.9: P 6501:6601(100) ack 1 win 2920 <nop,nop,timestamp 419502 419485>
07:42:54.778549 IP 10.10.0.2.39129 > 10.40.0.2.9: P 6601:6701(100) ack 1 win 2920 <nop,nop,timestamp 419503 419485>
07:42:54.787179 IP 10.40.0.2.9 > 10.10.0.2.39129: . ack 5701 win 4696 <nop,nop,timestamp 419487 419492>
07:42:54.787218 IP 10.40.0.2.9 > 10.10.0.2.39129: . ack 5801 win 4696 <nop,nop,timestamp 419488 419493>
07:42:54.795535 IP 10.10.0.2.39129 > 10.40.0.2.9: P 6701:6801(100) ack 1 win 2920 <nop,nop,timestamp 419504 419488>
07:42:54.798563 IP 10.10.0.2.39129 > 10.40.0.2.9: P 6801:6901(100) ack 1 win 2920 <nop,nop,timestamp 419505 419488>
07:42:54.809308 IP 10.10.0.2.39129 > 10.40.0.2.9: P 6901:7001(100) ack 1 win 2920 <nop,nop,timestamp 419506 419488>
07:42:54.809396 IP 10.40.0.2.9 > 10.10.0.2.39129: . ack 5901 win 4696 <nop,nop,timestamp 419490 419494>
07:42:54.809428 IP 10.40.0.2.9 > 10.10.0.2.39129: . ack 6001 win 4696 <nop,nop,timestamp 419490 419495>
07:42:54.809478 IP 10.40.0.2.9 > 10.10.0.2.39129: . ack 6101 win 4696 <nop,nop,timestamp 419490 419496>
07:42:54.819462 IP 10.10.0.2.39129 > 10.40.0.2.9: P 7001:7101(100) ack 1 win 2920 <nop,nop,timestamp 419507 419490>
07:42:54.827382 IP 10.40.0.2.9 > 10.10.0.2.39129: . ack 6201 win 4696 <nop,nop,timestamp 419492 419497>
07:42:54.836769 IP 10.10.0.2.39129 > 10.40.0.2.9: P 7101:7201(100) ack 1 win 2920 <nop,nop,timestamp 419508 419492>
07:42:54.838586 IP 10.10.0.2.39129 > 10.40.0.2.9: P 7201:7301(100) ack 1 win 2920 <nop,nop,timestamp 419509 419492>
07:42:54.848551 IP 10.10.0.2.39129 > 10.40.0.2.9: P 7301:7401(100) ack 1 win 2920 <nop,nop,timestamp 419510 419492>
07:42:54.857208 IP 10.40.0.2.9 > 10.10.0.2.39129: . ack 6301 win 4696 <nop,nop,timestamp 419494 419498>
07:42:54.857250 IP 10.40.0.2.9 > 10.10.0.2.39129: . ack 6401 win 4696 <nop,nop,timestamp 419495 419500>
07:42:54.865575 IP 10.10.0.2.39129 > 10.40.0.2.9: P 7401:7501(100) ack 1 win 2920 <nop,nop,timestamp 419511 419495>
07:42:54.868510 IP 10.10.0.2.39129 > 10.40.0.2.9: P 7501:7601(100) ack 1 win 2920 <nop,nop,timestamp 419512 419495>
07:42:54.878548 IP 10.10.0.2.39129 > 10.40.0.2.9: P 7601:7701(100) ack 1 win 2920 <nop,nop,timestamp 419513 419495>
07:42:54.887580 IP 10.40.0.2.9 > 10.10.0.2.39129: . ack 6501 win 4696 <nop,nop,timestamp 419497 419501>
07:42:54.887623 IP 10.40.0.2.9 > 10.10.0.2.39129: . ack 6601 win 4696 <nop,nop,timestamp 419497 419502>
07:42:54.887645 IP 10.40.0.2.9 > 10.10.0.2.39129: . ack 6701 win 4696 <nop,nop,timestamp 419497 419503>
07:42:54.889082 IP 10.10.0.2.39129 > 10.40.0.2.9: P 7701:7801(100) ack 1 win 2920 <nop,nop,timestamp 419514 419497>
07:42:54.899100 IP 10.10.0.2.39129 > 10.40.0.2.9: P 7801:7901(100) ack 1 win 2920 <nop,nop,timestamp 419515 419497>
07:42:54.907719 IP 10.40.0.2.9 > 10.10.0.2.39129: . ack 6801 win 4696 <nop,nop,timestamp 419500 419504>
07:42:54.907765 IP 10.40.0.2.9 > 10.10.0.2.39129: . ack 6901 win 4696 <nop,nop,timestamp 419500 419505>
07:42:54.913171 IP 10.40.0.2.9 > 10.10.0.2.39129: . ack 7001 win 4696 <nop,nop,timestamp 419501 419506>
07:42:54.920988 IP 10.10.0.2.39129 > 10.40.0.2.9: P 7901:8001(100) ack 1 win 2920 <nop,nop,timestamp 419517 419501>
07:42:54.923661 IP 10.40.0.2.9 > 10.10.0.2.39129: . ack 7101 win 4696 <nop,nop,timestamp 419502 419507>
07:42:54.930013 IP 10.10.0.2.39129 > 10.40.0.2.9: P 8001:8101(100) ack 1 win 2920 <nop,nop,timestamp 419518 419502>
07:42:54.938282 IP 10.40.0.2.9 > 10.10.0.2.39129: . ack 7201 win 4696 <nop,nop,timestamp 419504 419508>
07:42:54.943109 IP 10.40.0.2.9 > 10.10.0.2.39129: . ack 7301 win 4696 <nop,nop,timestamp 419504 419509>
07:42:54.949972 IP 10.10.0.2.39129 > 10.40.0.2.9: P 8101:8201(100) ack 1 win 2920 <nop,nop,timestamp 419520 419504>
07:42:54.958440 IP 10.10.0.2.39129 > 10.40.0.2.9: P 8201:8301(100) ack 1 win 2920 <nop,nop,timestamp 419521 419504>
07:42:54.958915 IP 10.40.0.2.9 > 10.10.0.2.39129: . ack 7401 win 4696 <nop,nop,timestamp 419504 419510>
07:42:54.969186 IP 10.10.0.2.39129 > 10.40.0.2.9: P 8301:8401(100) ack 1 win 2920 <nop,nop,timestamp 419522 419504>
07:42:54.977841 IP 10.40.0.2.9 > 10.10.0.2.39129: . ack 7501 win 4696 <nop,nop,timestamp 419507 419511>
07:42:54.977882 IP 10.40.0.2.9 > 10.10.0.2.39129: . ack 7601 win 4696 <nop,nop,timestamp 419507 419512>
07:42:54.983086 IP 10.40.0.2.9 > 10.10.0.2.39129: . ack 7701 win 4696 <nop,nop,timestamp 419507 419513>
07:42:54.990638 IP 10.10.0.2.39129 > 10.40.0.2.9: P 8401:8501(100) ack 1 win 2920 <nop,nop,timestamp 419524 419507>
07:42:54.998482 IP 10.10.0.2.39129 > 10.40.0.2.9: P 8501:8601(100) ack 1 win 2920 <nop,nop,timestamp 419525 419507>
07:42:55.007154 IP 10.40.0.2.9 > 10.10.0.2.39129: . ack 7801 win 4696 <nop,nop,timestamp 419509 419514>
07:42:55.007196 IP 10.40.0.2.9 > 10.10.0.2.39129: . ack 7901 win 4696 <nop,nop,timestamp 419510 419515>
07:42:55.015396 IP 10.10.0.2.39129 > 10.40.0.2.9: P 8601:8701(100) ack 1 win 2920 <nop,nop,timestamp 419526 419510>
07:42:55.018588 IP 10.10.0.2.39129 > 10.40.0.2.9: P 8701:8801(100) ack 1 win 2920 <nop,nop,timestamp 419527 419510>
07:42:55.029088 IP 10.10.0.2.39129 > 10.40.0.2.9: P 8801:8901(100) ack 1 win 2920 <nop,nop,timestamp 419528 419510>
07:42:55.029171 IP 10.40.0.2.9 > 10.10.0.2.39129: . ack 8001 win 4696 <nop,nop,timestamp 419512 419517>
07:42:55.033128 IP 10.40.0.2.9 > 10.10.0.2.39129: . ack 8101 win 4696 <nop,nop,timestamp 419513 419518>
07:42:55.042989 IP 10.10.0.2.39129 > 10.40.0.2.9: P 8901:9001(100) ack 1 win 2920 <nop,nop,timestamp 419529 419513>
07:42:55.048550 IP 10.10.0.2.39129 > 10.40.0.2.9: P 9001:9101(100) ack 1 win 2920 <nop,nop,timestamp 419530 419513>
07:42:55.058511 IP 10.10.0.2.39129 > 10.40.0.2.9: P 9101:9201(100) ack 1 win 2920 <nop,nop,timestamp 419531 419513>
07:42:55.067160 IP 10.40.0.2.9 > 10.10.0.2.39129: . ack 8201 win 4696 <nop,nop,timestamp 419515 419520>
07:42:55.067258 IP 10.40.0.2.9 > 10.10.0.2.39129: . ack 8301 win 4696 <nop,nop,timestamp 419516 419521>
07:42:55.073220 IP 10.40.0.2.9 > 10.10.0.2.39129: . ack 8401 win 4696 <nop,nop,timestamp 419517 419522>
07:42:55.081404 IP 10.10.0.2.39129 > 10.40.0.2.9: P 9201:9301(100) ack 1 win 2920 <nop,nop,timestamp 419533 419517>
07:42:55.088472 IP 10.10.0.2.39129 > 10.40.0.2.9: P 9301:9401(100) ack 1 win 2920 <nop,nop,timestamp 419534 419517>
07:42:55.096359 IP 10.40.0.2.9 > 10.10.0.2.39129: . ack 8501 win 4696 <nop,nop,timestamp 419519 419524>
07:42:55.103099 IP 10.40.0.2.9 > 10.10.0.2.39129: . ack 8601 win 4696 <nop,nop,timestamp 419519 419525>
07:42:55.111509 IP 10.10.0.2.39129 > 10.40.0.2.9: P 9401:9501(100) ack 1 win 2920 <nop,nop,timestamp 419536 419519>
07:42:55.118603 IP 10.10.0.2.39129 > 10.40.0.2.9: P 9501:9601(100) ack 1 win 2920 <nop,nop,timestamp 419537 419519>
07:42:55.126224 IP 10.40.0.2.9 > 10.10.0.2.39129: . ack 8701 win 4696 <nop,nop,timestamp 419522 419526>
07:42:55.126272 IP 10.40.0.2.9 > 10.10.0.2.39129: . ack 8801 win 4696 <nop,nop,timestamp 419522 419527>
07:42:55.133158 IP 10.40.0.2.9 > 10.10.0.2.39129: . ack 8901 win 4696 <nop,nop,timestamp 419523 419528>
07:42:55.141413 IP 10.10.0.2.39129 > 10.40.0.2.9: P 9601:9701(100) ack 1 win 2920 <nop,nop,timestamp 419539 419523>
07:42:55.144110 IP 10.40.0.2.9 > 10.10.0.2.39129: . ack 9001 win 4696 <nop,nop,timestamp 419525 419529>
07:42:55.152721 IP 10.10.0.2.39129 > 10.40.0.2.9: P 9701:9801(100) ack 1 win 2920 <nop,nop,timestamp 419540 419525>
07:42:55.153514 IP 10.40.0.2.9 > 10.10.0.2.39129: . ack 9101 win 4696 <nop,nop,timestamp 419525 419530>
07:42:55.159858 IP 10.10.0.2.39129 > 10.40.0.2.9: P 9801:9901(100) ack 1 win 2920 <nop,nop,timestamp 419541 419525>
07:42:55.169097 IP 10.40.0.2.9 > 10.10.0.2.39129: . ack 9201 win 4696 <nop,nop,timestamp 419525 419531>
07:42:55.169160 IP 10.10.0.2.39129 > 10.40.0.2.9: P 9901:10001(100) ack 1 win 2920 <nop,nop,timestamp 419542 419525>
07:42:55.179616 IP 10.10.0.2.39129 > 10.40.0.2.9: F 10001:10001(0) ack 1 win 2920 <nop,nop,timestamp 419543 419525>
07:42:55.196288 IP 10.40.0.2.9 > 10.10.0.2.39129: . ack 9301 win 4696 <nop,nop,timestamp 419528 419533>
07:42:55.196331 IP 10.40.0.2.9 > 10.10.0.2.39129: . ack 9401 win 4696 <nop,nop,timestamp 419529 419534>
07:42:55.213150 IP 10.40.0.2.9 > 10.10.0.2.39129: . ack 9501 win 4696 <nop,nop,timestamp 419531 419536>
07:42:55.223677 IP 10.40.0.2.9 > 10.10.0.2.39129: . ack 9601 win 4696 <nop,nop,timestamp 419532 419537>
07:42:55.243103 IP 10.40.0.2.9 > 10.10.0.2.39129: . ack 9701 win 4696 <nop,nop,timestamp 419534 419539>
07:42:55.263017 IP 10.40.0.2.9 > 10.10.0.2.39129: . ack 9801 win 4696 <nop,nop,timestamp 419536 419540>
07:42:55.263040 IP 10.40.0.2.9 > 10.10.0.2.39129: . ack 9901 win 4696 <nop,nop,timestamp 419536 419541>
07:42:55.273495 IP 10.40.0.2.9 > 10.10.0.2.39129: . ack 10001 win 4696 <nop,nop,timestamp 419537 419542>
07:42:55.293158 IP 10.40.0.2.9 > 10.10.0.2.39129: F 1:1(0) ack 10002 win 4696 <nop,nop,timestamp 419538 419543>
07:42:55.293552 IP 10.10.0.2.39129 > 10.40.0.2.9: . ack 2 win 2920 <nop,nop,timestamp 419554 419538>

